3696,812,3,p,p,静かな立地、落ち着きのあるインテリア、最高のベッド、ビジネスに必要なものはすべてあり、これからも愛用させてもらいます。,,,1,,,,,,,,,,,,,,,,3697,813,1,p,p,全てに清潔で気持ちよく過ごせました。,,,1,,,,3698,813,2,p,p,大井町駅からも近く、大変便利です。,,1,,,,,3699,813,3,Z,Z,また、利用させていただきます。,,,,,,,1,,,,,,,,,,,,3700,814,1,p,p,お部屋はきれいでベッドが広く、快適でした。,,,1,,,,,,,,,,,,,,,,3701,815,1,p,p,雨の日だったので、駅から近くて助かりました。,,1,,,,,3702,815,2,p,p,女性限定プランだったからか、クレンジングシートやフェイスパックなど色々置いて下さっていて嬉しかったです。,1,,,1,,,3703,815,3,p,Z,また利用させて戴きます！,,,,,,,1,,,,,,,,,,,,3704,816,1,p,p,無料サービスの朝食が美味しいです。,,,,,,1,3705,816,2,p,p,部屋もゆっくりできますし。,,,1,,,,3706,816,3,p,p,加湿器もついていて乾燥対策も完璧です。,,,,1,,,,,,,,,,,,,,,3707,817,1,p,p,駅前で観光にも立地的には最高でした。,,1,,,,,3708,817,2,p,p,スタッフの対応も親切で好感が持てました。,1,,,,,,3709,817,3,Z,Z,機会があればまた利用したいと思います。,,,,,,,1,,,,,,,,,,,,3710,818,1,Z,Z,久しぶりに一泊させて頂きました。,,,,,,,13711,818,2,p,Z,フロントにて、禁煙のお部屋ご用意出来ましたと言われ部屋に向かうと南側のツインにグレードアップしていました。,,,1,,,,3712,818,3,Z,Z,恐縮です。,,,,,,,13713,818,4,p,p,個人的には北向きのシングルのお部屋も大好きです。,,,1,,,,3714,818,5,Z,Z,夜外に出かけて、戻って、フロントにて名前を言う前にカギが用意していました。,1,,,,,,3715,818,6,p,p,関心しました。,,,,,,,13716,818,7,p,p,朝食も美味しく頂きました。,,,,,,1,3717,818,8,Z,Z,色々ありがとうございました。,,,,,,,13718,818,9,Z,Z,また札幌に行くときはお世話になります。,,,,,,,1,,,,,,,,,,,,3719,819,1,p,p,とても寒い日でしたが、到着してすぐ温かいおしぼりを出してくださって、とても嬉しかったです。,1,,,,,,3720,819,2,p,p,お部屋もとても広く、過ごしやすかったです。,,,1,,,,3721,819,3,p,p,駅も近くて、大変便利です。,,1,,,,,,,,,,,,,,,,,3722,820,1,p,p,駅を降りてすぐ目の前にそびえることから、非常に立地条件が良い。,,1,,,,,3723,820,2,p,p,朝食サービスというのも魅力があり、朝早くビジネスに出かけるには便利であり、フロントの対応も良かった。,1,,,,,1,3724,820,3,Z,Z,また利用したい。,,,,,,,1,,,,,,,,,,,,3725,821,1,Z,Z,主人の還暦祝いの記念に、ＴＤＲでの宿泊を選びました。,,,,,,,13726,821,2,p,p,とてもリーズナブルなお値段で宿泊出来て、大満足です。,,,,,,,13727,821,3,p,p,お部屋も綺麗で、お掃除も行き届いておりバスルームも広くとても使いやすかったです。,,,1,,,,3728,821,4,p,p,朝食も、とても美味しく品数も多く、ついつい食べ過ぎてしまいました。,,,,,,1,3729,821,5,k,Z,ただ一つ、舞浜駅からのシャトルバスが、平日の運行が無い事を忘れて15分程待ってしまいました。,,1,,,,,3730,821,6,Z,Z,また、泊まりたいと思います。,,,,,,,1,,,,,,,,,,,,3731,822,1,p,p,前回はツインで利用して今回はセミダブルを利用したのですが２人でいても全く窮屈な感じがなく快適に過ごせました。。,,,1,,,,3732,822,2,p,p,また新聞について尋ねたところ部屋まで持ってきていただいたりサービスもよかったです。,1,,,,,,,,,,,,,,,,,,3733,823,1,p,p,この値段で朝食付きとは大変得だった。,,,,,,1,,,,,,,,,,,,,3734,824,1,Z,Z,徳山に泊まるときはいつも利用しています。,,,,,,,13735,824,2,Z,Z,今回は、色々なアメニティが付いたプランでした。,,,,1,,,3736,824,3,p,p,頂くまで気にかけていませんでしたが、いつもの価格にもかかわらず、なかかな充実したセットでした。,,,,1,,,3737,824,4,p,p,また、ホテルのすぐ隣に綺麗なバー？ができていました。,,,,,,1,3738,824,5,Z,Z,機会があればまた利用します。,,,,,,,1,,,,,,,,,,,,3739,825,1,p,p,チェックイン〜アウトまでの時間が長いので便利。,1,,,,,,,,,,,,,,,,,,3740,826,1,p,p,接客対応がとても良く、気持ちよく利用させて頂きました。,1,,,,,,3741,826,2,p,Z,また機会がありましたら是非宜しく御願い致します。,,,,,,,1,,,,,,,,,,,,3742,827,1,p,p,部屋のお風呂で温泉が楽しめるのは良いですね。,,,,,1,,3743,827,2,p,p,プチ弁当もゴハンがもっちりしていて美味しかったです。,,,,,,1,,,,,,,,,,,,,3744,828,1,Z,Z,岐阜で用事があって宿泊しました。,,,,,,,13745,828,2,p,Z,駅からすぐの事もあって岐阜まで１５分ほどで行け，岐阜でホテルを取るのと変わりがありませんでした。,,1,,,,,3746,828,3,p,p,部屋は言う事も無く，APAのホテルではトイレが狭いと感じる事もたまにあるのですが，そんな事も無く，一晩だけとは言え快適に過ごさせて頂きました。,,,1,,,,,,,,,,,,,,,,3747,829,1,p,p,博多駅まで送迎サービスは、通常のホテル前に待機しているタクシーの様にすぐ対応していただけるので、非常に便利でありがたいです。,1,,,,,,,,,,,,,,,,,,3748,830,1,p,p,とても広くゆったりと宿泊できました。,,,1,,,,3749,830,2,p,p,アメニティーも良かったです。,,,,1,,,,,,,,,,,,,,,3750,831,1,p,p,フロントの対応が素早く丁寧ですね。,1,,,,,,3751,831,2,Z,Z,いつも盛岡出張の際は泊まってます。,,,,,,,1,,,,,,,,,,,,3752,832,1,Z,Z,足立美術館の真隣です。,,1,,,,,3753,832,2,p,p,そちらが目的であれば、とても便利です。,,,,,,,13754,832,3,p,p,温泉もあるので、のんびり出来るでしょう。,,,,,1,,3755,832,4,Z,Z,I.,,,,,,,13756,832,5,p,p,Cからもわかりやすい表示がありますので、迷わずいけました。,,1,,,,,,,,,,,,,,,,,3757,833,1,p,p,まあ良かった,,,,,,,1,,,,,,,,,,,,3758,834,1,Z,Z,出張で利用させていただきました。,,,,,,,13759,834,2,p,p,露天風呂と檜風呂が良かったです。,,,,,1,,3760,834,3,Z,Z,ウィークデーは男性だけのようでしたが…。,,,,,,,13761,834,4,p,p,また、今まで泊まったビジネスホテルでは見たことの無い大画面の液晶テレビも良かったです。,,,1,1,,,3762,834,5,p,p,近所に飲食店を見つけられなかったのですが、１階の餃子屋さんで満足しました。,,1,,,,,,,,,,,,,,,,,3763,835,1,Z,Z,一泊しました。,,,,,,,13764,835,2,p,p,部屋もきれいで、空気清浄機あり、消臭スプレーありと翌日も快適な気分になります。,,,1,1,,,3765,835,3,p,p,チェックアウトの際、清掃の方の挨拶が気持ちよかったです。,1,,,,,,,,,,,,,,,,,,3766,836,1,Z,Z,チェックアウト時に領収書をもらい忘れ、後日郵送頂きました。,1,,,,,,3767,836,2,Z,Z,対応ありがとうございました。,,,,,,,1,,,,,,,,,,,,3768,837,1,p,p,天然温泉の朝風呂でお肌すべすべ＆つるつる（~o~）お部屋でスッピンでゆっくりと朝食弁当が美味しかったです。,,,,,1,,,,,,,,,,,,,,3769,838,1,p,p,部屋のサイズ、清潔感すべて満足です,,,1,,,,,,,,,,,,,,,,3770,839,1,p,p,ポイント10倍でしかも1000ポイントギフトカードがついててお得感バッチリです。,,,,,,,13771,839,2,p,p,駅からホント近くて骨折してて歩くの不便な時だったので助かりました。,,1,,,,,,,,,,,,,,,,,3772,840,1,kp,e,フリースペースでの飲み物の種類が少なすぎる意外は、客室の質感もよく、ゆったり過ごすことができました。,,,1,,,,3773,840,2,p,p,ビジネスでの利用がおすすめです。,,,,,,,1,,,,,,,,,,,,3774,841,1,Z,Z,今月2度目の宿泊でした。,,,,,,,13775,841,2,p,p,非常に冷えた日でしたが、館内および室内は寒さを感じることもなく、快適に過ごせました。,,,1,,,,3776,841,3,p,p,また、おいしい朝食もおいしくいただけました。,,,,,,1,3777,841,4,p,p,また、大浴場のおかげで、長距離移動の疲れも癒すことができました。,,,,,1,,,,,,,,,,,,,,3778,842,1,p,p,駅から近くコンビにも近くにあり、この値段なので大満足です。,,1,,,,,3779,842,2,Z,Z,機会があればまた利用させていただきます。,,,,,,,1,,,,,,,,,,,,3780,843,1,p,p,この値段ではいいと思いました。,,,,,,,1,,,,,,,,,,,,3781,844,1,p,o,子供と泊ったのですが、お願いしなくてもキャラクタールームに変えて戴きました。,,,1,,,,3782,844,2,p,p,部屋も綺麗でフロントの方も皆さん親切でした。,1,,1,,,,3783,844,3,p,Z,ユニバーサルスタジオにも近くてつぎも絶対泊りたいです。,,1,,,,,,,,,,,,,,,,,3784,845,1,Z,Z,素泊まりで利用しました。,,,,,,,13785,845,2,p,p,下関駅から近いし飲食街にも近いのでとても助かりました。,,1,,,,,,,,,,,,,,,,,3786,846,1,p,p,加湿器、イオンドライヤー、ＰＯＬＡ製品のアメニティと女性には嬉しい備えでした☆,,,,1,,,3787,846,2,p,p,彡また、11:00チェックアウトの為、ゆっくりできてよかったです。,1,,,,,,,,,,,,,,,,,,3788,847,1,p,p,料金も安く部屋が広くて、また利用します,,,1,,,,,,,,,,,,,,,,3789,848,1,p,p,安価格プランで予約したので、とてもお得感があって良かったです。,,,,,,,13790,848,2,p,p,お部屋も広く、ゆったりしていたのでゆっくりくつろげました。,,,1,,,,,,,,,,,,,,,,3791,849,1,Z,Z,いつもお世話になっています。,,,,,,,13792,849,2,k,Z,最近はお客様が多いようで、温泉が少し混んでいました。,,,,,1,,3793,849,3,Z,Z,今回はお友達をお連れしました。,,,,,,,13794,849,4,p,p,その方も気に入ったようで今度はご夫妻で来たいとおっしゃってました。,,,,,,,13795,849,5,p,p,いつものように快適に過ごせました。,,,,,,,13796,849,6,p,p,朝御飯もおいしかったです。,,,,,,1,3797,849,7,Z,Z,また宜しくお願いします。,,,,,,,1,,,,,,,,,,,,3798,850,1,Z,Z,出張で利用させていただきました。,,,,,,,13799,850,2,p,p,博多駅、コンビニ、レストラン街に近く、部屋もきれいで、夜は屋台も少しありました。,,1,,,,,3800,850,3,p,p,Kinko'sも近いので書類作成も助かりました。,,1,,,,,3801,850,4,Z,Z,また次回利用します。,,,,,,,1,,,,,,,,,,,,3802,851,1,Z,Z,1/1〜1/2、１泊でお世話になりました。,,,,,,,13803,851,2,p,p,子供がやんちゃで、無理を承知で部屋食を希望した処、夕朝食とも対応していただき感謝しております。,1,,,,,1,3804,851,3,kp,e,貸切抹茶露天風呂もややぬるめでしたが、眼下に渓流を眺めながら大変すばらしいひと時をすごさせていただきました。,,,,,1,,3805,851,4,p,p,また朝の中庭で開催された、もちつきと猪鍋のイベントは子供が喜び、食べられなかった牛蒡がすきになったようです。,,,,,,1,3806,851,5,p,Z,今度は夏にうかがえたら、より一層すてきな体験ができると思いました。,,,,,,,1,,,,,,,,,,,,3807,852,1,p,p,部屋の希望など聞いていただきありがとうございました。,1,,,,,,3808,852,2,p,p,またチェックアウト後にもかかわらず、自転車をお貸しいただき、近くのスーパーまで紙オムツを買いに走り、大助かりでした。,1,,,,,,,,,,,,,,,,,,3809,853,1,Z,Z,私が海外出張で日本不在にする間、私に代わり都内で入院中の弟の面倒をみてもらう為、両親に上京してもらった際に利用。,,,,,,,13810,853,2,p,p,立地が良く、部屋も広く清潔で大変心地よく滞在できたと両親から報告を受けました。,,1,1,,,,3811,853,3,Z,Z,また来月以降も利用させて頂きたいと思います。,,,,,,,1,,,,,,,,,,,,3812,854,1,Z,Z,先日はお世話になりました。,,,,,,,13813,854,2,Z,Z,忘れ物をしてしまい、着払いで送って頂く様お願いしたのですが、送料をそちらでご負担頂いたようで申し訳ございません。,1,,,,,,3814,854,3,p,p,丁寧な対応で、大変、気持ちよく利用できました。,1,,,,,,3815,854,4,Z,Z,また徳山に行く際は是非利用させて頂きます。,,,,,,,1,,,,,,,,,,,,3816,855,1,Z,Z,12月28日に宿泊しました。,,,,,,,13817,855,2,p,p,エントランスがとてもきれいでした。,,,,,,,13818,855,3,p,p,お部屋は、普通にきれいでした。,,,1,,,,3819,855,4,Z,Z,忘れ物をしてしまったのですが、消耗品だったため、あきらめていたら、わざわざお電話を頂、処分にお手間をかけました。,1,,,,,,3820,855,5,p,Z,神戸に出向いたときは、また是非利用させていただきたいと思います,,,,,,,1,,,,,,,,,,,,3821,856,1,p,p,幼児２人連れの宿泊でしたが、食事に個室の座敷を用意して頂いていたり、急遽その場で追加をお願いしたお子様ランチもすぐに対応して下さいました。,1,,,,,1,3822,856,2,p,p,スタッフの方も、みなさんお忙しい中子ども達にまでとても丁寧に接して頂き、食事も十分な量でおいしかったです。,1,,,,,1,3823,856,3,p,p,お部屋もお風呂も含め、手頃なお値段でみな大満足でした。,,,1,,1,,3824,856,4,p,Z,ぜひまた利用させて頂きたいです。,,,,,,,1,,,,,,,,,,,,3825,857,1,p,p,部屋はとても広くベッドも大きくてよく眠れました。,,,1,,,,3826,857,2,p,p,近くにスーパーもあり便利でした。,,1,,,,,3827,857,3,Z,Z,また近くに出掛ける際は利用したいと思います。,,,,,,,1,,,,,,,,,,,,3828,858,1,p,p,展望大浴場とレストランが気に入りました！,,,,,1,1,3829,858,2,Z,Z,また、来たいと思います。,,,,,,,1,,,,,,,,,,,,3830,859,1,p,p,安価で、満足してます。,,,,,,,13831,859,2,p,p,夜中遅く帰ってきても、気持ちよく対応されて良かった,1,,,,,,,,,,,,,,,,,,3832,860,1,p,Z,お勧めです★,,,,,,,13833,860,2,k,Z,浅草ビューの真向かいで銀座線からは少し離れてますが・・・。,,1,,,,,3834,860,3,p,p,ベッドッも良い感じでぐっすり寝れました。,,,1,,,,3835,860,4,p,p,セキュリティーのなかなかで宿泊カードキーをエレベーター内でかざすタイプなので安心できます。,,,,1,,,3836,860,5,p,p,朝食はそこそこですが、ドリンクを１杯テイクアウトできるサービスがあり嬉しく感じました。,,,,,,1,3837,860,6,o,o,このサービスを継続に期待致します。,,,,,,,1,,,,,,,,,,,,3838,861,1,Z,Z,最上階の格安シングルルームに宿泊しました。,,,,,,,13839,861,2,p,p,太田駅前の立地で安かったので決めました。,,1,,,,,3840,861,3,p,Z,屋上の設備の音がうるさいからとのことでしたが、それほど気にならなかったです。,,,1,,,,3841,861,4,p,p,十分に満足できました。,,,,,,,1,,,,,,,,,,,,3842,862,1,Z,Z,ありがとうございました。,,,,,,,13843,862,2,Z,Z,次回また機会があれば利用させていただきます。,,,,,,,1,,,,,,,,,,,,3844,863,1,Z,Z,本社出張の度に常宿にさせていただいております。,,,,,,,13845,863,2,p,p,オークラ系のホテルだけあって、これまで何度となく期待を上回るサービスを受けました。,1,,,,,,3846,863,3,p,p,コストパフォーマンスの非常に高いホテルで、今後もプライベートでも利用し続けると思いますので、宜しくお願いします。,,,,,,,1,,,,,,,,,,,,3847,864,1,Z,Z,今回は、ホテル内で仕事をしたかったので、宿泊しました。,,,,,,,13848,864,2,p,Z,他のホテルに比べて、部屋が明るいので宿泊することにしました。,,,1,,,,3849,864,3,p,p,机の照明も、部屋の照明も蛍光灯で、明るいのがいいですね。,,,1,1,,,3850,864,4,p,p,あと、コーヒーの無料も良い。,,,,,,1,3851,864,5,p,p,また、座っていると腰が痛くなるが、ベットの硬さがちょうどいいので、朝はすっきり。,,,1,,,,3852,864,6,p,p,いいホテルです。,,,,,,,13853,864,7,p,p,受験等でホテルに宿泊する人にも、いいホテルだと思います。,,,,,,,1,,,,,,,,,,,,3854,865,1,p,p,駅から近く、商店街、お城にも近くて便利だし、部屋も綺麗で良かった。,,1,1,,,,3855,865,2,p,p,無料の朝食サービスであったが、食べ物、飲み物とも有料サービスに劣らない内容で、感激した。,,,,,,1,,,,,,,,,,,,,3856,866,1,p,p,近くにコンビニがあり、その隣に古本屋があり、そういう点では便利です。,,1,,,,,,,,,,,,,,,,,3857,867,1,p,p,温泉付だと誤解して泊まりましたが、ゆったりしていてよかったです。,,,,,1,,3858,867,2,Z,Z,また利用させていただきます。,,,,,,,1,,,,,,,,,,,,3859,868,1,Z,Z,いつも利用しています。,,,,,,,13860,868,2,p,p,部屋が広くて圧迫感がなく＆きれいです。,,,1,,,,,,,,,,,,,,,,3861,869,1,Z,Z,東京からの出張者２名に宿泊してもらうために２部屋予約しました。,,,,,,,13862,869,2,p,p,釧路らしい朝食に、天然温泉と、大変好評でした。,,,,,1,,3863,869,3,p,p,クイーンルームも、ビジネスホテルルームと違い、一段格上ぽっく感じてもらえ、宿泊翌営業日にさっそく、お礼の社内メールが入り、もてなす当方側としてもうれしく感じました。,,,1,,,,,,,,,,,,,,,,3864,870,1,p,p,コンビニも近いし、成田空港への送迎もあるので、便利です。,,1,,,,,,,,,,,,,,,,,3865,871,1,p,p,とてもお値打ちなプランだったので、なんだかこちらが申し訳なってしまうくらい新しく立派なホテルでした。,,,,,,,13866,871,2,p,p,ロビーや客室の雰囲気も重厚かつ洗練されていて、ゆっくりくつろげました。,,,1,,,,3867,871,3,p,p,高層階の客室から見る大阪の夜景もきれいでした。,,,1,,,,3868,871,4,p,p,PR文みたいになってしまいましたが、それ位気に入ったということで勘弁してください。,,,,,,,13869,871,5,Z,Z,大好きな大阪にまた遊びに行くときには、またぜひ利用させていただきます。,,,,,,,13870,871,6,p,p,人におすすめできるホテルです!,,,,,,,1,,,,,,,,,,,,3871,872,1,p,p,部屋は広くて大変良いです。,,,1,,,,,,,,,,,,,,,,3872,873,1,p,p,出張のため宿泊しましたが、立地が大変よく朝食も美味しくいただきました。,,1,,,,1,3873,873,2,Z,Z,また、利用したいと思います。,,,,,,,1,,,,,,,,,,,,3874,874,1,p,p,繁華街やコンビニが近くにあったので、立地がよかったです。,,1,,,,,3875,874,2,p,p,また、朝食を食べる場所のスペースもさほど狭くなかったので快適に過ごせました。,,,,,,1,,,,,,,,,,,,,3876,875,1,p,p,地下鉄の駅近くコンビにも近くて立地は凄く良く室内でも快適に過ごす事が出来ました。,,1,,,,,,,,,,,,,,,,,3877,876,1,p,p,部屋も広く，テレビもベッドから見るのに全く不満の無いサイズでした．,,,1,,,,3878,876,2,p,p,またフロントの対応も良かったです．,1,,,,,,3879,876,3,Z,Z,ありがとうございました．,,,,,,,1,,,,,,,,,,,,3880,877,1,p,p,布団がふかふかで気持ちよかった。,,,1,,,,3881,877,2,p,p,繁華街からも近くて便利でした。,,1,,,,,3882,877,3,p,p,和室だったのですが、とても快適に寝ることができました。,,,1,,,,3883,877,4,Z,Z,ありがとうございました。,,,,,,,1,,,,,,,,,,,,3884,878,1,p,p,立地もよく、快適な広さの部屋。,,1,,,,,3885,878,2,p,p,朝食もゆっくりと美味しくいただけました。,,,,,,1,3886,878,3,p,p,チェックアウトの際には、あめちゃんのプレゼントがありフロントの方の笑顔とともに癒されます。,1,,,,,,3887,878,4,Z,Z,是非大阪の定宿としたいと思います。,,,,,,,1,,,,,,,,,,,,3888,879,1,p,p,駅からも近く便利でした。,,1,,,,,,,,,,,,,,,,,3889,880,1,Z,Z,３月７日に宿泊しました。,,,,,,,13890,880,2,p,p,以前に宿泊した際に良かったので、また宿泊しました。,,,,,,,13891,880,3,kp,e,随分前でしたので、建物は多少古くなった感じはしましたが、朝のクロワッサンサービスやドリンクのサービスが付加されていたり、ワッフルのガウン、アメニティが更に充実された様で良かったです。,,,,1,,1,3892,880,4,p,p,スタッフの対応も良かったし、お値段に対する満足度は非常に高いと思います。,1,,,,,,3893,880,5,p,p,お勧め出来るホテルです。,,,,,,,1,,,,,,,,,,,,3894,881,1,Z,Z,いつも利用させていただいております。,,,,,,,13895,881,2,p,p,温泉の良さは抜群でした。,,,,,1,,3896,881,3,p,p,久しぶりにアネックスに泊まりましたがきれいな部屋でした。,,,,,,,13897,881,4,Z,Z,仕事で使ったためお風呂は朝のみしか入れませんでしたがいづれ夫婦でゆっくり泊まりたいと思っています。,,,,,1,,,,,,,,,,,,,,3898,882,1,p,p,駅から近く、部屋もきれいで気に入っています。,,1,1,,,,,,,,,,,,,,,,3899,883,1,Z,Z,先日はお世話になりました。,,,,,,,13900,883,2,kp,e,多少の不満はありますが金額が安いのと私の今回の目的は武道館でのライブ終了後に泊まるのが目的であり、そこに非常に近く、わかりやすい場所にあること、22時過ぎに戻ることが咎められないこと、チェックアウトが遅いので余裕があることが評価できます。,1,1,,,,,3901,883,3,ep,p,モニタープランのためサービスはそれほど求められないことは承知していましたし旅費等の節約のため食事も取りませんでしたのでその辺の評価ができないため「普通」という評価になっていますが料金と立地条件、加えてスタッフの方々の笑顔の対応が印象よかったので総合評価は平均点より上になります。,1,1,,,,,3902,883,4,Z,Z,ホテルに提出させていただいたアンケートにも書きましたが武道館ライブの夜に遠方からいらっしゃって宿泊をされるかたが多かったと思いますが若い方は特に格安ホテルを予約されると思います。,,,,,,,13903,883,5,Z,Z,グランドパレスさんは高級ホテルのイメージがあるので高いと思われて敬遠された人もいらっしゃると思います。,,,,,,,13904,883,6,p,p,今回のようなお値打ちプランなら皆様喜んで泊まられますよ。,,,,,,,13905,883,7,p,p,お二人なら一人3800円という超破格値は是非お友達同士やカップル、親子で泊まっていただきたいと思う価格設定です。,,,,,,,1,,,,,,,,,,,,3906,884,1,p,p,宿泊した次の日が、あいにくの雨でしたが、傘を貸してもらえてもらえたのが有り難かったです。,1,,,,,,,,,,,,,,,,,,3907,885,1,p,p,プラン名のとおり、ほんとうにお土産てんこ盛りでした。,1,,,,,,3908,885,2,Z,Z,夫婦で宿泊したので、赤かぶ漬け、おせんべい、朴葉みそ、高山ラーメンすべて２個づついただきました。,1,,,,,,3909,885,3,p,e,中でも春慶塗の夫婦ばしセットは思い出に残る一品です。,,,,,,,13910,885,4,p,p,お料理もおいしくて豪華、食べきれないほどでました。,,,,,,1,3911,885,5,p,p,夜はお口でとろける飛騨牛しゃぶしゃぶ、朝食も火をつけるものが二つもあって贅沢です。,,,,,,1,3912,885,6,p,p,温泉も広くて露天風呂ありでとても満足です。,,,,,1,,3913,885,7,p,p,もう一つ楽しみは大きなお土産ショップの物産館です。,,,,1,,,3914,885,8,p,p,ディスプレイも凝っていて何度行ってもあきません。,,,,,,,1,,,,,,,,,,,,3915,886,1,p,p,快適でしかも激安。,,,1,,,,3916,886,2,Z,Z,東京なら１万円クラス。,,,,,,,13917,886,3,p,p,グッズも充実。,,,,1,,,3918,886,4,p,p,駅前でありながら静か。,,1,,,,,3919,886,5,p,p,ビジネス利用に最適の宿,,,,,,,1,,,,,,,,,,,,3920,887,1,Z,Z,３月１０日に久しぶりに宿泊をさせていただきました。,,,,,,,13921,887,2,p,p,駐車場の係の方が私を覚えていてくれ、ほっと一安心です。,1,,,,,,3922,887,3,o,Z,チェツクイン後温泉に浸かりの〜んびりと、露天風呂は最悪の天候で横殴りの吹雪でした。が４月にまたお伺い致します。。。。,,,,,1,,,,,,,,,,,,,,3923,888,1,Z,Z,投稿が遅くなりました。,,,,,,,13924,888,2,Z,Z,１０月末に、両親と主人と４人で宿泊させて頂きました。,,,,,,,1