2566,481,6,e,e,なんとなく、最低限の物のみ用意、という感じがした。,,,,1,,,2567,481,7,k,k,あと、精算のときに、クレジット決済で手配していたのに全額請求され、指摘してすぐに確認・訂正請求していただいたが、「終わり良ければ・・・」の真逆で、一気に気持ちが冷めてしまった。（間違いは誰にでもあると思うが、やはりそこはちょっとという感じ）,1,,,,,,2568,481,8,k,k,料金とサービスのバランス、これまでに行った様々な宿泊施設と考え合わせ、残念ながら私の中では評価は下の方です。,,,,,,,1,,,,,,,,,,,,2569,482,1,k,k,コンビニが遠い。,,1,,,,,2570,482,2,k,k,ホテルには安価・質素はビニール傘しか売っていない。,1,,,,,,2571,482,3,k,k,突然の雨で有っても、安ビニール傘を購入しようとは思いません。,1,,,,,,2572,482,4,y,y,どうせ買うなら、しっかりした傘を購入したい。,,,,,,,1,,,,,,,,,,,,2573,483,1,Z,Z,出張の度に利用しています。,,,,,,,12574,483,2,p,p,部屋は広くてきれい。,,,1,,,,2575,483,3,p,p,掃除も行き届いています。,1,,,,,,2576,483,4,p,p,お風呂も広くて設備はすばらしい。,,,,,1,,2577,483,5,p,p,この料金でこのレベルの部屋に泊まることができるのは、心斎橋近辺ではここだけだと思います。,,,,,,,12578,483,6,p,p,スタッフの方の対応もとても親切です。（他のコメントで「部屋が狭い、風呂が広いとは思わない」と書いている人がいますが、このシングルの料金でもっと良い設備をもったホテルは近辺ではないと思います。）,1,,,,,,2579,483,7,Z,Z,今回夕食付のプランをはじめて利用しました。,,,,,,,12580,483,8,k,k,地下のレストランでコースの食事でしたが、＊料理がでてくるのが非常に遅かったです。,,,,,,1,2581,483,9,Z,Z,食事後に仕事で人に会う約束があったため、結局最後まで食べずに出てしまいました。,,,,,,,12582,483,10,k,k,お客さんは少なかったので、私たちは忘れられていたのかと思いました。,,,,,,,12583,483,11,k,k,飲み物は別料金なのに、その説明もありませんでした。,1,,,,,,2584,483,12,k,k,このプランは出張のビジネスマン向けではないと思います。,,,,,,,12585,483,13,e,e,のんびり食事したいカップル向けかと。。。,,,,,,,12586,483,14,p,p,料理はおいしかったです。,,,,,,1,2587,483,15,p,p,その他はいつも通り全て満足できるサービスでした。,1,,,,,,2588,483,16,p,p,チャックイン時のキャッシュバックくじも、良いアイディアだと思います。,,,,,,,12589,483,17,p,Z,ぜひまた利用したいと思います。,,,,,,,12590,483,18,Z,Z,【限定】朝食＆ディナー付シングル☆,,,,,,,1,,,,,,,,,,,,2591,484,1,p,p,スーパーホテルはよく利用させて頂いていますが、この値段では最高レベルのホテルだと思います。,,,,,,,12592,484,2,k,k,他のスーパーホテルと比べると温泉は狭い！！,,,,,1,,2593,484,3,p,e,大浴場というより小浴場ですが、炭酸泉というのはかなりポイント高いです！！,,,,,1,,2594,484,4,Z,Z,平日と日祝日で朝食の時間が違うんですね…。,,,,,,1,2595,484,5,k,k,スーパーホテルの朝食はいつも楽しみにしているので、食べられなくて残念でした。,,,,,,1,2596,484,6,k,k,立地面では、入口と駐車場が分かりにくかった。,,1,,,,,2597,484,7,k,k,アーケードに面しており、車だと入れないのは少し不便ですが、街中なのでしかたないですね。,,1,,,,,2598,484,8,p,p,でも繁華街が近く、周辺においしいお店がたくさんあるのはうれしい。,,1,,,,,2599,484,9,p,p,周辺のことは分からなかったのでフロントの方に尋ねると親切に教えてくださいました♪,1,,,,,,2600,484,10,k,k,このタイプの部屋は初めてで慣れていなかったため、ロフトベッドで何度か頭を打ちました。,,,1,,,,2601,484,11,p,p,でも、荷物が置けて部屋が広く使えます。,,,1,,,,2602,484,12,p,Z,学生のうちはまたぜひ利用したいと思います。,,,,,,,1,,,,,,,,,,,,2603,485,1,Z,Z,二度目の宿泊です。,,,,,,,12604,485,2,p,p,やはり部屋はきれいでアメニティも充実、風呂も広くてＴＶ付き等、代金に対するコストパフォーマンスは非常に高いと思います。,,,1,1,1,,2605,485,3,k,k,一つ気になったのは、スリッパの汚れ。,,,,1,,,2606,485,4,y,y,これは改善して欲しいです。,,,,,,,1,,,,,,,,,,,,2607,486,1,pk,k,立地も部屋も申し分なかったのですが、せっかくある大浴場を利用するのに、条件が多すぎてうんざりしました。（浴衣ダメ・スリッパダメ）,,1,1,,1,,2608,486,2,k,k,利用する気が無くなってしまったので、利用しませんでしたが、Barラウンジと一緒だからという理由だけでは納得できません。,,,,,,,1,,,,,,,,,,,,2609,487,1,p,p,接客に関してはかなりサービスが良いと感じました！,1,,,,,,2610,487,2,p,p,お風呂に関しても良かったのです。,,,,,1,,2611,487,3,k,k,しいて不満な点をあげると風呂場に浴衣があると記載してありましたが、浴衣がなかった。,,,,,1,,2612,487,4,k,k,壁が薄くまた階上も子供がいたのか、まるで同じ部屋にいるような感覚に陥るくらい、建物の壁や床が薄いのではと感じました。,,,1,,,,2613,487,5,p,p,従業員さんのサービスがよかったので、総合評価は普通以上に感じました！,1,,,,,,,,,,,,,,,,,,2614,488,1,k,k,今回久しぶりにこのプランで宿泊したが、まず受付の対応がおかしかった。,1,,,,,,2615,488,2,k,k,いつもは朝食券と応援グッズを渡してくれていたのが、くじ引きとカギしか出てこなかった。,1,,,,,,2616,488,3,o,e,朝食券をもらっていなかったので言おうと思っていたら、外から帰って来た時に渡された。,1,,,,,,2617,488,4,k,k,忘れていたのだと思うが「失礼しました。」の一言もなかった。,1,,,,,,2618,488,5,k,k,部屋は今回は８階だったが、ヒーターを入れたのに寒かった。（温度をどんどん上げて行ったのに全然きかなかった。）,,,1,,,,2619,488,6,k,e,朝、廊下に出たら室内よりもよほど暖かった。,,,1,,,,2620,488,7,k,k,冬はちょっときついと感じた。,,,,,,,1,,,,,,,,,,,,2621,489,1,Z,Z,鈴鹿サーキットでイベント等開催時に利用させていただいてます。,,,,,,,12622,489,2,p,p,朝食の質も以前と比べ格段に良くなり朝刊のサービスもあり大変満足で価格の割にしっか,,,,,,1,2623,489,3,p,p,りとしたお気に入りのホテルです。,,,,,,,12624,489,4,k,k,ただ、部屋の窓からの冷たい風が眠りを妨げるんですよね〜,,,1,,,,,,,,,,,,,,,,2625,490,1,Z,Z,6月オープンから何回も利用させて頂いておりますが、立地も御部屋もサービス,1,1,1,,,,2626,490,2,p,p,も言うことないと思います。,,,,,,,12627,490,3,p,p,特に洗濯機があるので最高です。,,,,1,,,2628,490,4,y,y,よくを言うなら椅子が後一つあれば良いのと御布団が羽毛なら最高です。,,,,1,,,2629,490,5,Z,Z,また来月も利用させていただこうと思います。,,,,,,,1,,,,,,,,,,,,2630,491,1,Z,Z,１２月２３日に宿泊しました。,,,,,,,12631,491,2,p,p,駅からは近くコンビニも近くにあり便利でした。,,1,,,,,2632,491,3,y,y,ただ部屋が暑く冷暖房の切り替えが出来ればもっと良かったです。,,,1,,,,,,,,,,,,,,,,2633,492,1,Z,Z,10年以上振りに福井に行きました。,,,,,,,12634,492,2,Z,Z,駅前が整備されて以前とは全く様子が変わっていて驚きました。,,,,,,,12635,492,3,k,k,駅との間に別のホテルがあるのでルートインさんが隠れてしまい、少し戸惑ってしまい>ました。,,1,,,,,2636,492,4,p,p,部屋の風呂ではどうもゆっくりできないのですが、大きな風呂があって良かったです。,,,1,,1,,2637,492,5,p,p,2周年特別価格とのことですが、リーズナブルな金額で利用できてラッキーでした。,,,,,,,12638,492,6,p,p,22時過ぎの到着、7時半の出発で慌ただしかったのですが、良く対応して頂き、助かりま>した。,1,,,,,,2639,492,7,Z,Z,ありがとうございました。,,,,,,,1,,,,,,,,,,,,2640,493,1,p,p,前回、朝食やコーヒーサービス、フロントの方の対応など、とても満足な利用>をさせていただきましたので、今回もビジネス利用させていただきました。,1,,,,,1,2641,493,2,k,k,今回の部屋は残念ながら、机のコンセントが利用できず、朝フロントの方を呼ぶには時>間がなかったため、机を移動し壁コンセントよりドライヤーを使用しました。,,,,1,,,2642,493,3,Z,Z,チェックアウト時にお伝えしたかったのですが、後ろに他のお客様もいたのでそのままに,,,,,,,12643,493,4,Z,Z,してしまいました。,,,,,,,12644,493,5,Z,Z,すみません。,,,,,,,12645,493,6,y,y,次回この部屋を利用する方のためにもチェックしておかれればと思います。,,,,,,,12646,493,7,p,p,他の点はとても満足していますので、次回も利用を考えています。,,,,,,,12647,493,8,Z,Z,お世話になりました。,,,,,,,1,,,,,,,,,,,,2648,494,1,p,p,繁華街も比較的近く、立地は申し分ありませんでした。,,1,,,,,2649,494,2,p,p,近くに立体駐車場もあって便利。,1,,,1,,,2650,494,3,k,k,ラストオーダーの時間前であることを確認して２階のレストランに入ろうとしたら既に>しまっていたのはちょっといただけませんが。。,1,,,,,1,,,,,,,,,,,,,2651,495,1,p,p,かなりお得で泊ってよかったです。,,,,,,,12652,495,2,p,p,値段・料理・お風呂からすると十分すぎ。,,,,,1,1,2653,495,3,Z,Z,"大人１人と幼児２人の計３名で夕朝２食付き、しかも休前日で全員で９,７００円でした>。",,,,,,,12654,495,4,Z,Z,夕食は鯛しゃぶ（４〜５切れ）・焼き肉（小４枚）他ごはんはおかわり放題。,,,,,,1,2655,495,5,Z,Z,生ビールは１杯５８０円でした。,,,,,,1,2656,495,6,Z,Z,お子様ランチはハンバーグ（直火鉄板つき）ウインナー・デザート。,,,,,,1,2657,495,7,kp,e,朝食のバイキングは品数は少ないですが、子供がロールパンがもっと欲しいというと親>切に何個も持ってきていただきました。,,,,,,1,2658,495,8,p,p,お風呂は別館で真新しくとても清潔できれいでした。,,,,,1,,2659,495,9,kp,e,子供には少し熱かったですが、露天風呂は肌がヌルツルになります。,,,,,1,,2660,495,10,kp,e,部屋は少し古いですがシーツ・枕類は清潔で、すでに敷いてくれてあったので子供は部>屋に入るとすぐ横になれてよかったです。,,,1,,,,2661,495,11,p,Z,ちょっと気分転換に泊るには十分すぎる内容で子供も大変喜んでいました。,,,,,,,1,,,,,,,,,,,,2662,496,1,pk,e,駅からは、案内どおりでわかりやすかったけど、けっこう歩きました。,,1,,,,,2663,496,2,p,p,安いプランだったので満足です。,,,,,,,12664,496,3,Z,Z,また機会があれば利用したいと思います。,,,,,,,1,,,,,,,,,,,,2665,497,1,p,p,部屋も広く、サービスも良いホテルでした。,1,,1,,,,2666,497,2,Z,Z,また、利用したいと思います。,,,,,,,12667,497,3,k,k,フロントまでが階段利用でしたので、キャスター付きのバッグだと、少し不便です。,1,,,,,,,,,,,,,,,,,,2668,498,1,Z,Z,12月9日に宿泊させていただきました。,,,,,,,12669,498,2,p,p,立地は渋谷駅から約3分ととても便利でした。,,1,,,,,2670,498,3,p,p,朝食もとてもおいしくいただきました。,,,,,,1,2671,498,4,ek,e,風呂はバスタブなしのシャワーのみで私は問題ありませんでしたが抵抗ある方にはおすすめできないです。,,,,,1,,2672,498,5,Z,Z,宿泊客には場所柄か欧米の方も多くみかけました。,,,,,,,12673,498,6,p,p,ホテル内もおしゃれかつ清潔で快適に過ごすことができました。,,,,,,,12674,498,7,Z,Z,リピします。,,,,,,,1,,,,,,,,,,,,2675,499,1,Z,Z,2月半ばに2泊しました。,,,,,,,12676,499,2,p,p,函館駅からすぐ、朝市の目の前で立地は最高です。,,1,,,,,2677,499,3,kp,e,ホテルライフを楽しもうという方には向かないと思いますが、このお値段で、この便利さ,,,,,,,12678,499,4,p,p,、そして親切なスタッフさん達。,1,,,,,,2679,499,5,p,Z,大変お世話になりました。,,,,,,,12680,499,6,kp,e,お部屋も、新しいとは言えませんが、値段から想像していたより広めで、クローゼットが,,,1,,,,2681,499,7,p,p,あったのが良かったです。,,,,,,,12682,499,8,kp,e,初め、部屋での無線LANが調子が悪かったのですが、フロントへ連絡すると、すぐに対応>してくださり、ばっちりつながるようになりました。,1,,,1,,,2683,499,9,p,e,全く不満点はありません。,,,,,,,12684,499,10,p,p,費用対効果は抜群です。,,,,,,,12685,499,11,p,Z,ぜひまた利用したいと思います。,,,,,,,1,,,,,,,,,,,,2686,500,1,k,k,楽天１０倍ポイントが付与されていません。,,,,,,,12687,500,2,y,y,確認をお願いいたします。,,,,,,,1,,,,,,,,,,,,2688,501,1,p,p,次の日シェラトンのジュニアスイートに泊まったが、食事・従業員の対応はＪＲタワーの方が上。,1,,,,,,2689,501,2,Z,Z,関係無いがシェラトンにはガッカリしたよ。,,,,,,,1,,,,,,,,,,,,2690,502,1,Z,Z,小倉に宿泊するときにはたまに利用させていただいています。,,,,,,,12691,502,2,p,p,朝食もおいしく大浴場もあり大変リラックスさせていただいています。,,,,,1,1,2692,502,3,p,p,駅から商店街のアーケードを通れば雨に濡れないのでそれもうれしいです。,,1,,,,,,,,,,,,,,,,,2693,503,1,p,p,駅から近く大変便利が良いです。,,1,,,,,2694,503,2,p,p,綺麗にリニューアルされ快適に過ごせました。,,,1,,,,,,,,,,,,,,,,2695,504,1,p,p,県庁のすぐ近くにあり、非常に便利な立地。,,1,,,,,2696,504,2,e,e,駅から、徒歩だと若干、歩きますが特に気にならない程度でした。,,1,,,,,2697,504,3,p,p,今回はツインでしたが、部屋の広さ、サービス、価格すべて満足です。,,,1,,,,2698,504,4,p,p,朝食のメニューも豊富で、非常においしかったです。,,,,,,1,,,,,,,,,,,,,2699,505,1,p,p,ホテル内１階の食事処が夜遅くまで営業していたので助かりました。,1,,,,,1,,,,,,,,,,,,,2700,506,1,Z,Z,12月11日に宿泊させていただきました。,,,,,,,12701,506,2,p,p,枕が丁度良い硬さと高さでゆっくりと休めてよかったです。,,,1,,,,2702,506,3,Z,Z,ありがとうございました。,,,,,,,1,,,,,,,,,,,,2703,507,1,p,p,料金の割には部屋も風呂も満足できました。,,,1,,1,,2704,507,2,p,p,コストパフォーマンスは最高です。,,,,,,,1,,,,,,,,,,,,2705,508,1,p,p,子連れで行ったのですが、子供に、とても親切で良かったです。,1,,,,,,2706,508,2,p,p,色々聞いても、分かりやすく説明もしていただき、とても助かりました。,1,,,,,,2707,508,3,p,p,掃除の方に、朝会ったのですが、朝から気持ちいい笑顔で接して頂き、子供にも声を掛けていただきました。,1,,,,,,2708,508,4,p,p,ある方には、子供が廊下でごねてると、声を掛けていただき、機嫌もとっていただきました。,1,,,,,,2709,508,5,p,p,子連れだと、気になること等色々あるのですが、みんな楽しく過ごせました。,,,,,,,1,,,,,,,,,,,,2710,509,1,p,p,リーズナブルなわりには部屋も綺麗なので、毎回出張の際には利用させて頂いてます。,,,1,,,,2711,509,2,p,p,ベットの堅さが自分好みなので、よく眠れるので助かります。,,,1,,,,,,,,,,,,,,,,2712,510,1,p,p,「朝食付き」、おいしかったです。,,,,,,1,2713,510,2,p,p,館内、部屋もきれいで、フロントの方々も感じ良くさわやかな対応です。,1,,1,,,,2714,510,3,p,Z,ホテル独自のポイントカードもあり是非また宿泊したいです。,,,,,,,1,,,,,,,,,,,,2715,511,1,p,p,いいと思いますまた利用する〜＾＾,,,,,,,1,,,,,,,,,,,,2716,512,1,Z,Z,今回初めて利用させてもらいました。,,,,,,,12717,512,2,p,p,無料朝食ということだったので、全く期待しておりませんでしたが、十分な内容でした。,,,,,,1,2718,512,3,p,p,全然ありだと思います。,,,,,,,12719,512,4,e,e,全体的にキレイなホテルなので、多少部屋の狭さは、許容範囲でした。,,,1,,,,2720,512,5,p,p,一番良かったのは、受付の女性スタッフが、とてもすばらしい接遇でした！,1,,,,,,2721,512,6,p,p,北見市内のホテルは、いくつも利用していますが、容姿もサービスもＮＯ１の方でした。,1,,,,,,2722,512,7,p,Z,また、利用させて頂きます！,,,,,,,1,,,,,,,,,,,,2723,513,1,p,p,朝食が美味しかったです。,,,,,,1,,,,,,,,,,,,,2724,514,1,p,p,今回も気持ちよく泊まらせてもらいました。,,,,,,,12725,514,2,Z,Z,みなさんありがとうございました。,,,,,,,1,,,,,,,,,,,,2726,515,1,p,p,神田明神に初詣に行くのに近い場所だったので良かったです。,,1,,,,,2727,515,2,p,p,朝食のパンがとても美味しかったです。,,,,,,1,,,,,,,,,,,,,2728,516,1,k,Z,朝食がもう少し。,,,,,,1,,,,,,,,,,,,,2729,517,1,p,p,今回は車を利用しましたが、駐車場も沢山確保されており、助かりました。,,,,1,,,2730,517,2,Z,Z,夕食は、ホテルで用意していただいたマップを見て、近くのお店を利用しました。,1,,,,,,2731,517,3,p,p,朝食はホテルのバイキング料理でしたが、品数も豊富でいずれの食品も味が良く、大満足でした。,,,,,,1,2732,517,4,p,p,ホテルには、大浴場が設置されており旅の疲れを癒すことができました。,,,,,1,,2733,517,5,p,p,またフロントの皆様の対応も、親切・丁寧で感謝しています。,1,,,,,,,,,,,,,,,,,,2734,518,1,Z,Z,３度目の利用です。,,,,,,,12735,518,2,p,p,ここのホテルはフォーラスと金沢駅のすぐ前に立地してありとても便利だということと、最上階に温泉があるということで選びました。,,1,,,,,2736,518,3,p,p,とても気に入っています。,,,,,,,12737,518,4,p,p,夫婦、４歳の息子の三人で泊ったので幅１６０センチもあるダブルベットでのびのびと眠れてとても快適でした。,,,1,,,,2738,518,5,p,o,たまたまお正月だったからなのか分かりませんが、２１時半から２２時半までの間に１階のレストランに行けば無料でラーメンが食べれました。,1,,,,,1,2739,518,6,p,p,味は期待していませんでしたが、とても美味しくいただき嬉しかったです。,,,,,,1,2740,518,7,p,p,ぎりぎりに行ったのにも関わらず、スタッフの方が嫌な顔もせずラーメンを作ってくれました。,1,,,,,,2741,518,8,Z,Z,ありがとうございました。,,,,,,,12742,518,9,Z,Z,機会があれば、また利用したいです。,,,,,,,1,,,,,,,,,,,,2743,519,1,p,p,部屋が広いことが第一の満足です。,,,1,,,,2744,519,2,p,p,駅のすぐそばの立地は最適です。,,1,,,,,,,,,,,,,,,,,2745,520,1,p,p,カプセルですが、とても快適に泊まれ毎回利用してます。,,,,,,,12746,520,2,p,p,朝食も大浴場もサウナ十分に満足できる値段です,,,,,1,1,,,,,,,,,,,,,2747,521,1,Z,Z,初めて利用させていたざきました。,,,,,,,12748,521,2,p,p,仕事から帰ると部屋に暖房が入れてあり、寒い日でしたが、とても嬉しいサービースでした。,1,,1,,,,2749,521,3,Z,Z,また利用させていたざきます。,,,,,,,12750,521,4,Z,Z,ありがとうございました。,,,,,,,1,,,,,,,,,,,,2751,522,1,p,p,東京をあまり知らない母の一人旅に安くて便利なホテルないかと頼まれ予約し、とても満足して帰ってきました。,,,,,,,12752,522,2,p,p,私も系列のホテル利用者でありますが、ここの良さは立地と大浴場。,,1,,,1,,2753,522,3,p,p,疲れもとれてまた遊びに行こうともう今から次の旅行を計画しているようです。,,,,,,,12754,522,4,Z,Z,本当にお世話になりありがとうございました。,,,,,,,1,,,,,,,,,,,,2755,523,1,Z,Z,２回目の利用です。,,,,,,,12756,523,2,p,p,私には丁度良い、繁華街に近からず遠からず。,,1,,,,,2757,523,3,p,p,少し歩いて繁華街なので静かに眠る事が出来ますし、またタクシーを利用する事なく夜の街にも出られます。,,1,,,,,2758,523,4,Z,Z,また出張の折には利用します。,,,,,,,1,,,,,,,,,,,,2759,524,1,Z,Z,結婚記念日だったので温泉旅行にと、一泊宿泊させていただきました。,,,,,,,12760,524,2,p,p,親切な従業員の方々、おいしい料理ととても満足のいく旅行になったと思います。,1,,,,,1,2761,524,3,p,Z,子供が大きくなったらまた行きたいと思います（＾ｕ＾）,,,,,,,1,,,,,,,,,,,,2762,525,1,Z,Z,食事なしのプランで利用しました。,,,,,,,12763,525,2,p,p,駅前なので少し歩くと食事ができるお店もコンビニもあります。,,1,,,,,2764,525,3,p,p,LANが使えるのですが、ケーブルも貸してもらいました。,,,,1,,,2765,525,4,p,p,便利さ重視の方にお勧めだと思います。,,,,,,,1,,,,,,,,,,,,2766,526,1,p,p,二食付きで食事も美味しく満足でした。,,,,,,1,,,,,,,,,,,,,2767,527,1,p,p,駐車場が無料はありがたいです。,1,,,1,,,2768,527,2,p,p,安いプランですが大浴場もあり部屋も綺麗にされているので次も利用したいです。,,,1,,1,,,,,,,,,,,,,,2769,528,1,Z,Z,先日仕事が終わらず急遽予約しました。,,,,,,,12770,528,2,ep,p,部屋自体は、普通でしたがフロントの対応も良く特筆するならば姫路のホテル何件か泊まりましたが（ビジネスホテル）他に比べてベットの寝心地が大変良いのと周りのお客さんのマナーも良くて静かでぐっすり眠らせて頂きました。,1,,1,,,,2771,528,3,p,Z,また是非利用したいと思います,,,,,,,1,,,,,,,,,,,,2772,529,1,Z,Z,ディーズニーランドの帰りに利用しました。,,,,,,,12773,529,2,p,p,まず、お部屋が広くて、うれしかったです。,,,1,,,,2774,529,3,Z,Z,お風呂も。,,,,,1,,2775,529,4,p,p,ホテルも大きくて、綺麗で、泊まるだけで、あまり、施設は、利用できませんでしたが、この値段とこの内容は本当にお得だと思います。,,,,,,,12776,529,5,p,Z,朝食もゆっくりいただきました。,,,,,,1,2777,529,6,Z,Z,洋食も和食もあって、、食べ過ぎました。,,,,,,1,2778,529,7,Z,Z,また、利用したいと思います。,,,,,,,12779,529,8,Z,Z,ありがとうございました。,,,,,,,1,,,,,,,,,,,,2780,530,1,Z,Z,飲み会で遅くなる時に時々利用しています。,,,,,,,12781,530,2,p,p,今回は格安で泊まれたので良かったです。,,,,,,,12782,530,3,p,p,おしぼりのサービスは良かった（^_^）v,1,,,,,,,,,,,,,,,,,,2783,531,1,p,p,部屋も綺麗でサービスもいき届いていて良い宿泊が出来ました。,1,,1,,,,2784,531,2,Z,Z,また機会があれば利用したいと思います。,,,,,,,1,,,,,,,,,,,,2785,532,1,Z,Z,先日、一泊しました。,,,,,,,12786,532,2,Z,Z,何度か宿泊していましたが、今回は高知龍馬であい博を観る目的で高知に宿泊しました。,,,,,,,12787,532,3,Z,Z,今回全ての会場を観れなかったので、期間中にもう一度高知に来ようと思います。,,,,,,,12788,532,4,kp,e,立地的には中心から少し歩きますが、徒歩圏内ですし、郷土料理とサービス等大満足でした。,,1,,,,,2789,532,5,Z,Z,次回宿泊時もよろしくお願いします。,,,,,,,1,,,,,,,,,,,,2790,533,1,Z,Z,閑静な住宅街にぽつんとある旅館です。,,,,,,,12791,533,2,p,p,素敵な庭と気持ちいい風呂。,,,,,1,,2792,533,3,p,p,浴衣もアメニティもマッサージチェアもＣＤもＰＣも満足。,,,,1,,,2793,533,4,p,p,何より内装の雰囲気が落ち着きます。,,,1,,,,2794,533,5,Z,Z,今回は到着が遅く、ゆっくりできなかったのが悔しいくらい。,,,,,,,12795,533,6,Z,Z,また利用させていただきます。,,,,,,,1,,,,,,,,,,,,2796,534,1,p,p,立地の割にかかくが安い。,,1,,,,,2797,534,2,Z,Z,また、利用します。,,,,,,,1,,,,,,,,,,,,