行ID,文書ID,文書内ID,anotation1,anotation2,文,サービス,立地,部屋,設備・アメニティー,風呂,食事,その他2155,417,1,p,o,当日予約で突然のお願いだったのに荷物を預かってもらえてありがとうございました。,1,,,,,,2156,417,2,p,p,場所は駅から近いしよかったです。,,1,,,,,2157,417,3,p,o,コンビニも近い。,,1,,,,,2158,417,4,y,y,シャンプーなどが別々にあってほしい。,,,,,1,,2159,417,5,p,p,水のサービスは嬉しかった。,1,,,1,,,2160,417,6,p,p,部屋は照明もベッドも可愛かったです,,,1,,,,,,,,,,,,,,,,2161,418,1,Z,Z,蟹につられて６年ぶりに再利用しました。,,,,,,1,2162,418,2,p,p,安い料金のに８回の部屋を用意してもらい恐縮でした。,,,1,,,,2163,418,3,kp,p,蟹の味は今一でしたが、他の料理が山ほどあり、美味しかったです。,,,,,,1,2164,418,4,p,p,温泉はすごくいいです。,,,,,1,,2165,418,5,kp,e,温泉街から離れてるのが少し寂しいですが、フロントの人達はみなさん素敵な男女です。,1,1,,,,,2166,418,6,Z,Z,また三朝の湯に行ってみたいです。,,,,,1,,,,,,,,,,,,,,2167,419,1,Z,Z,３月３日と３月４日に宿泊しました。,,,,,,,12168,419,2,k,k,ドライヤーが備え付けられていなく、困惑しました。,,,,1,,,2169,419,3,p,p,食事がおいしかったです。,,,,,,1,2170,419,4,Z,Z,お世話になりました。,,,,,,,1,,,,,,,,,,,,2171,420,1,p,p,とても広く清潔な室内でとても満足しています。,,,1,,,,2172,420,2,k,k,ただ、バスルームの換気扇が動かなかったのと、インターネット接続環境が部屋に無かった事は残念です。,1,,,1,,,2173,420,3,p,p,ベッドや・枕・シーツ等は最高でした。,,,1,,,,2174,420,4,Z,Z,また利用しようと思います。,,,,,,,1,,,,,,,,,,,,2175,421,1,k,k,ゴトゴトとうるさかった。（リネン室？）,,,,,,,1,,,,,,,,,,,,2176,422,1,p,p,当日、ツインに変更して下さったのでとても快適に過ごすことが出来ました。,1,,1,,,,2177,422,2,p,p,窓からの景色も楽しむことが出来ました。,,1,1,,,,2178,422,3,pk,e,風呂はカビ臭い臭いもなく本来なら「大変満足」にしたかったのですが、構造上、浴槽が丸い形をしていたため、浴槽とカーテンとの間に隙間があり、シャワーの水が一部外に出てしまったため１点減らしました。,,,,,1,,2179,422,4,Z,Z,また利用できればと思います。,,,,,,,1,,,,,,,,,,,,2180,423,1,Z,Z,９月２７日に３９００円割引で宿泊しました。,,,,,,,12181,423,2,p,p,正直あまり期待していなかったのですが、ロビーもリニューアルされていてとてもきれいでしたし、子供たちの騒ぎ声もなく本当にゆっくり落ち着いて過ごす事ができました。,,,,,,,12182,423,3,p,p,部屋食でまったりできましたし、量・質ともに満足いくものでした！,,,,,,1,2183,423,4,p,p,楽しみにしていた花火も見れましたし、お湯もなかなかよかったです。,,1,,,1,,2184,423,5,k,k,ちょっとぬるめでしたが。,,,,,1,,2185,423,6,p,p,お土産のお米もおいしくいただきました。,,,,,,1,2186,423,7,Z,Z,ありがとうございました！！,,,,,,,12187,423,8,p,p,大型連休を避けたのが正解だったと感じています。,,,,,,,12188,423,9,p,Z,また機会があったら宿泊させていただきたいと思います☆,,,,,,,1,,,,,,,,,,,,2189,424,1,p,p,交通の便がよく、また、ホテルの方も親切で良かったです。,1,1,,,,,2190,424,2,pk,e,部屋のつくりもおしゃれなのでいいのですが、ただ、上の階の客のどんどんと走る騒音がうるさく、まるで安ホテルのような作りではないのかと思いました。,,,1,,,,1,,,,,,,,,,,,2191,425,1,k,k,2月末に宿泊しました、日曜日だったのですが時間帯も悪かったのかチェックインするのに並ばなければならず結構窓口は多く開いていたのですが少し待たされました。,1,,,,,,2192,425,2,y,y,ちょっと対応を考えたら如何でしょうか。,,,,,,,12193,425,3,p,Z,部屋は4階でしたが海も見えて部屋も広くゆっくりくつろげましたし、お月様と日の出も部屋から大変きれいに見ることも出来ました。,,,1,,,,2194,425,4,y,k,食事はチェックイン時には7時30分と遅く告げられたのでゆっくりお風呂に入っており、部屋へ帰ったら6時から大丈夫との連絡がありこの辺りの連携は改善して欲しいですね。,1,,,,,,2195,425,5,p,p,食事はバイキングでしたが品数・量共に十分で満足しました、当分はマグロとカニは要らないって感じでした。,,,,,,1,,,,,,,,,,,,,2196,426,1,p,p,スタッフの方はとても親切にして下さり良かったです。,1,,,,,,2197,426,2,k,k,ただ、お部屋が想像していた部屋より狭かったのが残念でした。,,,1,,,,,,,,,,,,,,,,2198,427,1,p,p,値段が安く、朝食もついていたのでよかったです。,1,,,,,,12199,427,2,p,p,部屋も、小さい子どもがいたので、２つに仕切れるところが大人も助かりました。,,,1,,,,2200,427,3,k,k,ただ、畳が悪いのか、黒いタイツにすぐに畳のかすが付き取れなかった。,,,1,,,,2201,427,4,Z,Z,仕方がないので、近くでパジャマのズボンを買いました。,,,,,,,12202,427,5,k,k,それと、部屋に置いてあるパジャマも７分？で寒かったです。,1,,,,,,,,,,,,,,,,,,2203,428,1,k,k,ドライヤーの威力が弱すぎで、風邪引いてしまう。,,,,1,,,2204,428,2,k,k,貸出しされるドライヤーまでもが、威力が弱い。,,,,1,,,,,,,,,,,,,,,2205,429,1,Z,Z,二度めの宿泊です。,,,,,,,12206,429,2,p,p,サービス対応は良かったです。,1,,,,,,2207,429,3,ke,e,立地は快速が止まらないのが不便ですが、まあまあ良いです。,,1,,,,,2208,429,4,Z,Z,周りには、すきやがありました。,,1,,,,,2209,429,5,e,o,エレベーターに近くなければ夜も静かです。,,,1,,,,2210,429,6,k,k,廊下の音は良くきこえます。,,,,,,,12211,429,7,k,k,部屋の温度調節はあまり良くなく、寝にくかったです。,,,1,,,,2212,429,8,k,k,トイレのウォシュレットは、温水が出ません。,,,,1,,,2213,429,9,Z,Z,個室も公衆も。,,,,1,,,2214,429,10,p,p,大浴場は、一人のスペースが広くて大満足です。,,,,,1,,2215,429,11,y,p,水圧もしっかりあった良いです。,,,,,1,,2216,429,12,k,k,時間によって混みます。,,,,,,,12217,429,13,y,k,もう少しまめに掃除に入ってゴミと髪の毛だけでもきれいだとたすかります。,1,,,,,,2218,429,14,p,e,朝食は、焼きたてではなくて、トーストできるパンですが美味しいです。,,,,,,1,2219,429,15,p,p,全体的に味がしっかりしています。,,,,,,1,2220,429,16,Z,Z,中国の方々が多いからでしょうか。,,,,,,,12221,429,17,y,y,卵料理は薄いほうが良かったかも。,,,,,,1,2222,429,18,p,p,中華粥も美味しかったです。,,,,,,1,2223,429,19,y,y,好みもありますが、もう少し素材の味をアピールでもいいかなと思います。,,,,,,1,2224,429,20,e,Z,他のアパより濃いかも。,,,,,,,12225,429,21,k,k,氷機械が一台故障して、残り一台に並びましたが、追いつかず氷が出ませんでした。,,,,,,1,2226,429,22,y,y,ズボンプレッサより氷を各階に設置したほうが需要にあうと思います。,,,,,,1,2227,429,23,p,k,新しいし、テレビが大きいので快適でした。,,,1,,,,2228,429,24,p,Z,また機会があれば宿泊したいと思います。,,,,,,,1,,,,,,,,,,,,2229,430,1,Z,Z,こちらに宿泊するのは、今回で２回目でした。,,,,,,,12230,430,2,p,p,選んだ理由としては、駅からかなり近いということ。,,1,,,,,2231,430,3,p,p,チェックアウトが１２時だということ。,1,,,,,,2232,430,4,p,p,ホテルの方の感じがよかったこと。,,,,,,,12233,430,5,p,p,そして安い。,,,,,,,12234,430,6,Z,Z,でした。,,,,,,,12235,430,7,py,e,これだけですでに満足ですがまた利用させていただこうと思いますので要望を書きたいと思います。,,,,,,,12236,430,8,ky,k,まず、ホテルのベッドとベッドの上のモノを置くスペースに謎の直径１センチほどの黒い塊がいくつもあり（天井からおちてきたのかなと思いましたがそんな感じでもなかったです。）手で払いのけましたが、掃除を徹底していただきたかったです。,,,1,,,,2237,430,9,k,k,そしてシャワーの出が悪かったです。,,,,,1,,2238,430,10,k,k,シャンプーを洗い流すのにとても時間がかかりました。。。,,,,,1,,2239,430,11,y,y,最後にわがままをいうのであれば、朝食にヨーグルトのような簡単なデザートがついてくれたらなと思いました。,,,,,,1,2240,430,12,p,p,リーズナブルでとても気に入っているホテルです。,,,,,,,12241,430,13,Z,Z,これからもたくさんの方に利用していただきたいです。,,,,,,,1,,,,,,,,,,,,2242,431,1,p,p,大晦日から元旦にかけて宿泊しましたおかげで御殿場アウトレットに一般道で１時間かからず行くことができました。,,,,,,,12243,431,2,p,p,行く途中には富士山がきれいに見えたし、道もわかりやすかったです。,,1,,,,,2244,431,3,p,p,朝食バイイングは種類も豊富でお雑煮などお正月らしいおかずもあっておいしかったです。,,,,,,1,2245,431,4,k,k,１階のレストランでいただきましたが、せっかく富士山が見える立地なのでもっと上階にあるといいのになあと思いました温泉は１階フロント前にあり、入るのに鍵をもらはなくてはならず、チェックインのお客さんがいるときは気まずかったです。,,,,,1,1,2246,431,5,k,k,そして入ってびっくり、脱衣所のロッカーに鍵がなく棚だけ。,,,,,1,,2247,431,6,k,k,大人２人で満員状態。,,,,,,,12248,431,7,k,k,家族でゆっくり入るつもりが順番に荷物番をしての入浴となりとても残念でした。,,,,,1,,2249,431,8,k,k,温泉の質はよかったのにこの脱衣所では残念です。,,,,,1,,2250,431,9,e,Z,ホテルでくつろぐより買い物目的で利用なら仕方ないかもしれません,,,,,,,1,,,,,,,,,,,,2251,432,1,k,k,普通のビルの5階からがホテルなので場所がわかり難くて迷いました。,,1,,,,,2252,432,2,p,p,しかしホテル階は広いラウンジもありとても清潔で温かみがあり、高級感が漂っています。,,,,,,,12253,432,3,p,p,部屋もベッドが広く、椅子やテーブルも工夫されておりくつろげました。,,,1,,,,2254,432,4,p,p,またベッドのシーツも、ビジネスホテルにありがちな布団と敷布団に間にシーツが1枚あるだけのようなタイプでなく、掛け布団にシーツがついているタイプだったのでよかったです。,,,1,,,,2255,432,5,Z,Z,朝食は何種類かのパン・サラダ・スープ・シリアル・ヨーグルト等がありました。,,,,,,1,2256,432,6,y,k,パンが冷たく冷えていたので暖かければいいなと思いました。,,,,,,1,2257,432,7,p,p,とても満足できるホテルだったので、また仙台に出張するときは利用したいと思います。,,,,,,,1,,,,,,,,,,,,2258,433,1,Z,Z,出張で利用しました。,,,,,,,12259,433,2,p,p,部屋は申し分なく特にベット＆枕は快適でした。,,,1,,,,2260,433,3,y,y,今後の希望としては無線ＬＡＮを設置して宿泊客だけでもＷｉＦｉ等が利用できるようにして欲しいです。,,,,1,,,,,,,,,,,,,,,2261,434,1,Z,Z,いつもお世話になっております。,,,,,,,12262,434,2,p,p,また、この度も桜川沿いの505号室を用意して頂き有難う御座いました。,,,1,,,,2263,434,3,Z,Z,茨城へ行く時は必ずといっていいくらい利用させて頂いております。,,,,,,,12264,434,4,p,p,禁煙ルームが増える昨今私どもにとっていつもご配慮有り難く思っております。,1,,1,,,,2265,434,5,p,p,いつもながらの朝食バイキングも美味しく頂きました。,,,,,,1,2266,434,6,k,k,今回『煮物』がありませんでしたね。,,,,,,1,2267,434,7,k,k,一寸残念でした。,,,,,,,12268,434,8,p,p,カレーもいいですね。,,,,,,1,2269,434,9,p,p,私好みの味でつい御替りしてしまいました。,,,,,,1,2270,434,10,Z,Z,次回も利用させて頂きますのでその節はよろしく。,,,,,,,12271,434,11,Z,e,そうそう、書きたくなかったのですが、洗面所のドライヤー。,,,,1,,,2272,434,12,y,y,多分コンセントだと思いますが一度点検してみてください。,,,,1,,,,,,,,,,,,,,,2273,435,1,p,p,お料理はどれもおいしく、大満足でした！！,,,,,,1,2274,435,2,p,p,最後の桜えびごはんにデザートまで手が込んでいて良かったです。,,,,,,1,2275,435,3,k,k,お部屋にしかお風呂が無いのは、わかっていたとはいえ、ちょっとでした。,,,,,1,,2276,435,4,y,y,もう少し内風呂が大きいといいですね。,,,,,1,,2277,435,5,k,Z,特に寒い日でしたので・・・・いきなり露天にはいけないので。,,,,,1,,2278,435,6,k,k,お料理で出てきたおいしいお塩をおみやげに購入しましたが、近所のお店で半額で売っていたのにはびっくりでした。,,,,,,,1,,,,,,,,,,,,2279,436,1,p,p,名古屋駅から近いのでよかったです。,,1,,,,,2280,436,2,p,p,朝食のバイキングも種類も多く満足でした。,,,,,,1,2281,436,3,p,p,室内からインターネット接続するのにモデム貸し出しをしてくれたので助かりました。,,,,1,,,2282,436,4,k,k,モデムの使用方法などは部屋にあったのですが、モデムをフロントで貸し出しているというインフォメーションが無かったため、部屋中探し回ってしまいました。,,,,1,,,2283,436,5,y,y,チェックイン時に一言あるとよかったですね。,,,,,,,1,,,,,,,,,,,,2284,437,1,Z,Z,初めて利用させて頂きました。,,,,,,,12285,437,2,p,p,子供の引越しと大学の入学式があったので、二泊三日で宿泊しましたが、朝食はサラダやスープも美味しく頂きました。,,,,,,1,2286,437,3,p,p,皆さんが書かれているように、ウェルカムコーヒーは有り難いサービスでした。,,,,,,1,2287,437,4,p,p,お部屋は高い階のツインでしたが、静かで見晴らしも良く、快適に過ごさせて頂きました。,,,1,,,,2288,437,5,e,k,これは仕方ないかもしれませんが、ご用意頂いたナイトウェアが子供が長身なので、かなり短くて自分のスラックスを穿いて寝ました。（フロントに相談してみれば良かったかも・・と後で思いました。）,,,,1,,,2289,437,6,p,p,総合的にはとても気持ちよく宿泊させて頂きました。,,,,,,,12290,437,7,Z,Z,また機会が御座いましたら利用させて頂きたく存じます。,,,,,,,12291,437,8,Z,Z,お世話になりました。,,,,,,,1,,,,,,,,,,,,2292,438,1,Z,Z,初めて宿泊しました。,,,,,,,12293,438,2,p,p,噂には聞いていましたが、福井県では最高かもしれません。,,,,,,,12294,438,3,p,p,福井にはよく出張するのですが、今までで一番よかったです。,,,,,,,12295,438,4,p,p,また、当日限定の安い料金での宿泊でしたが、最近のビジネスホテルと違い、部屋が広くて清潔、とてもよかったです。,,,1,,,,2296,438,5,Z,Z,今回は朝食を取らなかったのですが、次回は朝食を食べてみたいと思います。,,,,,,1,2297,438,6,y,y,あと、駐車場の予約ができると有難いですね。,1,,,,,,2298,438,7,k,k,契約駐車場も場所がよくわからなかったです。,,1,,,,,,,,,,,,,,,,,2299,439,1,p,p,立地は最高、総合的には十分満足しています。,,1,,,,,2300,439,2,k,k,インターネット接続にはキットを借りる必要があるのですが、使い方説明が付属されておらず、初日は接続ができませんでした。,,,,1,,,2301,439,3,ky,k,原因は、壁からのケーブルがテレビ台の裏に隠れて見つからなかったためですが、説明書があったら探したと思います。,,,,1,,,,,,,,,,,,,,,2302,440,1,p,p,新しいらしく清潔で快適でした。,,,1,,,,2303,440,2,p,p,従業員もみな感じがいいし、お部屋も比較的広くてすごしやすかったです。,1,,,,,,2304,440,3,p,p,人口温泉のお風呂も最高でした〜。,,,,,1,,2305,440,4,p,p,疲れがとれます。,,,,,,,12306,440,5,k,k,唯一残念だったのが、朝食バイキングの補充がやたらと遅いこと。,,,,,,1,2307,440,6,k,k,3日のうち、納豆は1日しかｇｅｔできなかったし、１日は味噌汁が底をついた状態のまま。,,,,,,1,2308,440,7,Z,e,おかずもそんなのがちらほら・・・。,,,,,,1,2309,440,8,y,y,結構混んでいたので大変だとは思いますが、朝食は一日の始まりなのでもう少ししっかり見張って、補充してほしいです。,1,,,,,1,,,,,,,,,,,,,2310,441,1,Z,Z,家族4人で、ツイン2部屋、2泊お世話になりました。,,,1,,,,2311,441,2,p,p,便利の良いロケーションと、サービス感溢れるホスピタリティには満足できました。,1,1,,,,,2312,441,3,pk,e,10階の部屋を用意して頂き、見晴らしも良く、他の階の喧噪も気になりませんでしたが、エレベーターが１台しかなく、待たされることが気になりました。,,,1,,,,2313,441,4,pk,e,また、このようなホテルで、大浴場があること自体非常にめずらしく、十分なサービスだとは思いますが、タイミング悪く団体とかち合い、洗い場が使えないどころか、浴槽も芋洗い状態でした。,,,,,1,,2314,441,5,k,k,以上は、他の宿泊客とのタイミングで、ホテル側に対するお願いではありませんが、一点のみ、１階の売店及び飲食店の閉店時間が早く、寝酒を一杯と思っていましたがそれが出来ずちょっと不便を感じました。,1,,,,,,2315,441,6,k,k,町中にあるので、駐車料金一泊1000円も仕方ないのでしょうが、少し高いように感じました。,,,,,,,1,,,,,,,,,,,,2316,442,1,p,p,フロント・駐車場係りの対応良く、気持ちよく宿泊できました。,1,,,,,,2317,442,2,e,p,食事もまずまずでした。,,,,,,1,2318,442,3,k,k,ポイント会員募集していましたが、楽天からの予約ではポイント付与でくないとのことで残念でした。,,,,,,,1,,,,,,,,,,,,2319,443,1,Z,Z,初めて利用しました。,,,,,,,12320,443,2,p,p,駅からのアクセスもよく近くにコンビニもあり立地条件は申し分ないと思います。,,1,,,,,2321,443,3,p,p,フロントの方も親切に対応頂きました。,1,,,,,,2322,443,4,k,k,古いホテルなのでしょうがないと思いますが、ユニットバスやトイレは狭く、使いづらかったです。,,,,,1,,,,,,,,,,,,,,2323,444,1,pk,e,ホテル自体は申し分ないとは思いますが、いかんせんJRは阪急の駅から遠いのが・・・。,,1,,,,,2324,444,2,p,p,それ以外は本当に良いと思います。,,,,,,,12325,444,3,p,p,コンビニも近いし。,,1,,,,,,,,,,,,,,,,,2326,445,1,py,e,朝早い海外便のときは、いつも利用しています。という訳で良いところなのですが、ただ一つ、いまどきインターネットが時間単位で有料なのは、やめて戴けないでしょうか？,1,,,1,,,2327,445,2,Z,e,海外でもそんことは無くなっている時代です。,,,,,,,12328,445,3,Z,Z,この評価は、パリのホテルから（もちろんただで）書き込んでいます。,,,,,,,1,,,,,,,,,,,,2329,446,1,e,Z,頑張っているビジネスホテルだと思いますが...（再利用しました）,,,,,,,12330,446,2,p,p,【情報・良い点】ホテルは２つの建物に別れていて本館でチェックインをする。,1,,,,,,2331,446,3,Z,o,本館の禁煙フロアーは２フロアーだけ、西館は不明。,1,,,,,,2332,446,4,p,p,西館はオートロックでの出入り。（以前より味が良くなった）,,,,,,,12333,446,5,p,o,無料コーヒーのサービス。,,,,,,1,2334,446,6,Z,o,無料朝食は事前に献立の掲示があり日替わりメニュー。,,,,,,1,2335,446,7,p,p,朝食の時間が6:30AMからで、朝食のお米が新米になったのか良くなり、料理も改善された。,,,,,,1,2336,446,8,p,p,ベットが硬く寝心地が良かった。,,,1,,,,2337,446,9,p,p,部屋が間接照明だけでなく蛍光灯照明もあり明るかった。,,,1,,,,2338,446,10,p,o,加湿器の無料貸出、人口温泉の大浴場。,,,,1,1,,2339,446,11,p,p,清掃は全てに渡って充分されていた。,,,1,,,,2340,446,12,k,k,【気になった点】以前に指摘し改善するとレスがあったが、今回宿泊した部屋のリーフレットもコピーサービス１枚１０円と２０円と書いてあるものがありどちらが正しいのか意味不明。,1,,,,,,12341,446,13,k,k,ベットの枕が良くなかった。,,,1,,,,2342,446,14,k,k,大浴場の足拭きマットが水浸し状態で、水虫感染の原因。,,,,,1,,2343,446,15,k,k,大浴場の液体石鹸・シャンプーがPOLAからゆずの香りの物に変った。,,,,,1,,2344,446,16,k,k,朝食の料理で補充されないものがあった。,,,,,,1,2345,446,17,k,k,朝、エレベーターに乗るとタバコ臭かったが、喫煙所の空気清浄機の電源が入っていなかった。,1,,,,,,2346,446,18,k,k,今回もフロント係は大減点、理由は前回と違い予約上の問題が発生した。,1,,,,,,2347,446,19,y,y,基本とも言うべき事項で、思い込みは時間を必要とし、お客を不愉快にさせるだけなので、再び発生しないよう勉強して頂きたい。,1,,,,,,2348,446,20,y,y,【提案事項】西館にある無料PCを本館にも設置してもらえると嬉しい。,,,,1,,,2349,446,21,y,y,朝食にコーヒーだけでなく、紅茶の用意があると良い。,,,,,,1,2350,446,22,y,y,大浴場が乱れているので見回りを増やしましょう。,,,,,1,,2351,446,23,Z,Z,電子レンジの設置と空気清浄機の貸出。,,,,1,,,2352,446,24,y,y,大規模改修の時に部屋のエアコンは個別管理にすると尚良い。（外は涼しいが部屋の中は暑かったー扇風機の貸出？）,,,1,1,,,2353,446,25,Z,Z,【総合として】2009年5月に続き再び利用しました。,,,,,,,12354,446,26,py,e,改善されている点は評価できるが、まだまだ頑張って頂きたいと思います。,,,,,,,12355,446,27,Z,Z,新白河で泊まる時はまた利用するでしょう。,,,,,,,1,,,,,,,,,,,,2356,447,1,k,k,エアコンが機能せず冷房がきつく寒かったし朝食は見た目も味も悪く残念に思いました。,,,1,,,1,2357,447,2,k,k,６：３０〜９：３０の利用で、７：３０に行きましたが、お味噌汁が底のほうに少し残っていたので係の方に「まだありますか？」と声をかけたら面倒くさそうにかき混ぜ、はい。と答えたまま２０分間の滞在中足す様子はなかったので帰りました。,,,,,,1,2358,447,3,k,k,今までで最悪です。,,,,,,,12359,447,4,k,k,もう二度と利用しません。,,,,,,,1,,,,,,,,,,,,2360,448,1,pk,k,食事、部屋、接客、立地ともすべて満足のいくものですが、下の施設との絡みで、何となくエレベータが遅すぎて不便に感じました。,1,1,1,,,1,2361,448,2,Z,Z,また利用させていただきたいと思います。,,,,,,,1,,,,,,,,,,,,2362,449,1,p,p,「ロープウェイの姥子駅から行くつもりで強羅駅にいますが、チエックインが少し遅れます」と電話すると最終ロープウェイは、もうないとのことで早雲山駅へ車で迎えに来ていただきほんとうに助かりました。,1,1,,,,,2363,449,2,p,p,夕食はもう若くない私達には多すぎず適量で品数も多く美味しく楽しみながら頂くことができました。,,,,,,1,2364,449,3,p,p,朝食も和洋食から選べて満足でした。,,,,,,1,2365,449,4,k,k,部屋の暖房が室内で切っても暑くなって少し寝苦しかったです。,,,1,,,,2366,449,5,Z,Z,もう一度泊まって富士山を見てみたいなと思います。,,,,,,,1,,,,,,,,,,,,2367,450,1,Z,Z,本当は一万人の第九プランが希望だったのですが連泊の空きが無いとの事だったので、こちらから予約しました。,,,,,,,12368,450,2,p,p,禁煙室では無かったですが、ニオイも気にならずエレベーター近くの部屋を希望通り取っていただき大変助かりました。,,,1,,,,2369,450,3,y,y,ただ、回答いただきたいことがあります。（2点）,,,,,,,1