3018,610,2,p,p,駅から近いのでビジネスには便利です。,,1,,,,,,,,,,,,,,,,,3019,611,1,Z,Z,大浴場があるホテルしか泊まりません。,,,,,1,,3020,611,2,Z,Z,出張の際のホテル選びは、一番最初に御社の空室情報を確認します。,,,,,,,13021,611,3,Z,Z,大阪支社はＯＡＰタワーにありますので、真っ先に大阪天満の御社ホテルに空室状況を確認します。,,1,,,,,3022,611,4,p,p,また、大浴場付きであるのに手頃な宿泊料金が魅力です。,,,,,1,,3023,611,5,y,o,早朝、東京に戻ることが多いので、新大阪にもあれば本当に助かります。,,,,,,,13024,611,6,p,p,肥後橋も新しく良いですね。,,,,,,,1,,,,,,,,,,,,3025,612,1,p,p,今回は海外からの帰りだったので、大浴場があって非常に有り難かったです。,,,,,1,,3026,612,2,p,p,旅の疲れもしっかりとれました。,,,,,,,13027,612,3,p,p,宿泊後は都内の仕事もあったので、重い荷物を快く預かってもらえたことも有り難かったです。,1,,,,,,,,,,,,,,,,,,3028,613,1,p,p,当日に予約したのですが、お部屋のお風呂もよく貸切露天風呂もよく大満足です。,,,1,,1,,3029,613,2,p,Z,ぜひまた行いたいと思いました。,,,,,,,1,,,,,,,,,,,,3030,614,1,Z,Z,１０月１４日に宿泊しました。,,,,,,,13031,614,2,p,p,先ず受付けの後藤さんは、大変ご懇切で丁寧なご対応で第一印象がとても良かった。,1,,,,,,3032,614,3,p,p,食事は刺身定食・白峰定食・てんぷら定食を選びましたが、係の女性も楽しく十分に満足でした。,,,,,,1,3033,614,4,p,p,特に朝食は眺望のいいレストランでのバイクングでしたが、メニューも豊富で煮物など大満足でした。,,,,,,1,3034,614,5,p,p,かんぽの宿でも最上級でしょう、絶対にお勧めです。,,,,,,,1,,,,,,,,,,,,3035,615,1,p,p,レストランは特にランチはお得で美味しい。,,,,,,1,3036,615,2,p,p,朝食も値段からは想像以上の豪華。,,,,,,1,3037,615,3,p,p,また、職員さんは皆さん親切。,1,,,,,,3038,615,4,e,e,ホテルの概観はまあ、立派とは言えませんが中は広々てます。,,,1,,,,3039,615,5,p,p,全ての職員さんが、感じ良い事は何となくしあわせでした。,1,,,,,,3040,615,6,p,Z,また、酒田方面の場合には必ず来ます。,,,,,,,1,,,,,,,,,,,,3041,616,1,Z,Z,東京出張時には毎回利用させて頂いています。,,,,,,,13042,616,2,p,p,駅と同じ建物なので移動が楽で本当に助かります。,,1,,,,,,,,,,,,,,,,,3043,617,1,p,p,全体的にすごくよかったです。,,,,,,,1,,,,,,,,,,,,3044,618,1,p,p,この価格での宿泊は十分満足です。,,,,,,,13045,618,2,p,p,ホテルとはまた違った気軽出来る雰囲気は気に入っています。,,,,,,,13046,618,3,p,Z,是非また利用したいと思っています。,,,,,,,1,,,,,,,,,,,,3047,619,1,p,p,駅前なのに、比較的安く泊まれてよかったです。,,1,,,,,3048,619,2,p,p,周辺には飲食店も多いので素泊まりでいいかも…と思いました。,,1,,,,,,,,,,,,,,,,,3049,620,1,kp,e,宿泊する前は、お客様の声を読んで多少不安な点がありましたが、従業員の対応も良かった。,1,,,,,,3050,620,2,p,p,部屋が入ってすぐ畳があり、奥にベットがある作りになっていて温泉に入った後も大変くつろぐ事が出来ました。,,,1,,1,,3051,620,3,kp,e,温泉は、炭酸泉がチェックイン後に入浴した時は炭酸があまりなく、ただのお湯でしたが夜に入浴した時には炭酸がちゃんとあったので楽しむ事が出来ました。,,,,,1,,3052,620,4,p,p,朝食も種類がいろいろあって良かった中で、特に釜で炊いたおこげ飯が美味しかったです。,,,,,,1,3053,620,5,p,p,館内を作務衣とスリッパで移動できるのもリラックス出来て良かったです。,,,,1,,,3054,620,6,Z,Z,また宿泊したいと思います。,,,,,,,1,,,,,,,,,,,,3055,621,1,Z,Z,出張でいつも利用しています。,,,,,,,13056,621,2,p,p,料金が手頃で、チェックアウトが１１時なので、ゆっくり休めてありがたいです。,,,,,,,1,,,,,,,,,,,,3057,622,1,p,p,立地、フロントサービス、部屋、設備、どれをとっても満足です。,1,1,1,1,,,,,,,,,,,,,,,3058,623,1,Z,Z,松山に遊びに行く際にはよく利用します。,,,,,,,13059,623,2,p,p,立地は申し分なく、フロントの対応も大変満足しています。,1,1,,,,,3060,623,3,Z,o,また利用させてもらいます。,,,,,,,1,,,,,,,,,,,,3061,624,1,p,p,博多駅周辺には、かなり宿泊していますが、東洋ホテルも格安の値段で良かったです！,,1,,,,,3062,624,2,p,p,お勧めします！,,,,,,,1,,,,,,,,,,,,3063,625,1,p,p,いつも利用していますが、部屋はきれいでとても満足しています。,,,1,,,,3064,625,2,p,p,コーヒー無料サービスはとてもありがたいです。,,,,,,1,,,,,,,,,,,,,3065,626,1,Z,Z,11月26日に一泊しました。,,,,,,,13066,626,2,p,p,口コミ通り新しくきれいで気持ちよく過ごす事ができました。,,,1,,,,3067,626,3,p,p,チェックインまえに気持ちよく荷物も預かってもらえ身軽に行動もできアメニティーも女性のみ？,1,,,1,,,3068,626,4,p,p,入浴剤、ヘアゴム、コットンなどチェックイン時に欲しいものを要る分だけもらうことができました。,,,,1,,,3069,626,5,e,Z,朝食も7時代は特に混雑する事も無くしょくじができました。,,,,,,1,3070,626,6,p,Z,ぜひ次回もお世話になりたいホテルです。,,,,,,,1,,,,,,,,,,,,3071,627,1,p,p,浅草の泊まりはヤッパリここで間違いないっす。,,,,,,,13072,627,2,Z,Z,今日０２１３は駅向こうの温泉つきに泊まってみましたが、料金もプライドも高すぎて、論外。,,,,,,,13073,627,3,Z,Z,また、お願いします。,,,,,,,1,,,,,,,,,,,,3074,628,1,p,p,大幅に到着時間が遅れたにも拘わらず親切に対応して頂き有難うございました。,1,,,,,,3075,628,2,Z,Z,次回も利用させて頂きたく思います。,,,,,,,13076,628,3,Z,Z,末永く旅行者に愛される宿泊施設でありますように御社の成長と発展を祈ります。,,,,,,,13077,628,4,Z,Z,有難うございました。,,,,,,,1,,,,,,,,,,,,3078,629,1,p,p,とにかく部屋が広くて、お洒落で良かったです。,,,1,,,,3079,629,2,p,p,駅と直結しているので、移動もとても便利でした。,,1,,,,,,,,,,,,,,,,,3080,630,1,o,o,ビジネスホテルといえばどの部屋も同じなのが普通ですが、ここは部屋が変わると広さ・形状・備品が違います。,,,1,1,,,3081,630,2,p,p,バスルームにも違いがあり、今回は浴槽の水深が深いタイプで、肩までどっぷり漬かれました。,,,,,1,,3082,630,3,kp,e,同じなのは大き目のＴＶとベッドで、建物自体はやや古いもののスペース余裕はあり、周りが静かなので快眠できます。,,,1,1,,,3083,630,4,p,p,ちょっと前に宿泊した時には少し寒い全館暖房しかなかったですが、今回は個別のエアコンがあって効きは良かったです。,,,1,1,,,3084,630,5,p,p,６：３０開始の朝食（おにぎり＋味噌汁）もありがたく、この宿泊代で出して大丈夫か、と毎回思います。,,,,,,1,3085,630,6,Z,Z,ありがとうございました。,,,,,,,1,,,,,,,,,,,,3086,631,1,p,p,フロントの方の対応が良かったです。,1,,,,,,3087,631,2,p,p,むつ市内の事は全然分からないので、ご丁寧に教えて頂きました。,1,,,,,,3088,631,3,Z,Z,ありがとうございます。,,,,,,,1,,,,,,,,,,,,3089,632,1,p,p,コストパフォーマンスが素晴らしい。,,,,,,,13090,632,2,p,p,この部屋（広さ、景色）で、この風呂（露天は温泉）で、この料理（伊勢えび、さざえの刺身等）で、この料金は信じられません。,,,1,,1,1,3091,632,3,p,p,細かいことを言い出せば色々とあるのでしょうが、ここまでＣＰの良い宿は少ないのでは。,,,,,,,13092,632,4,kp,e,施設の古さ等の意見もありますが、とても得をした気分になれる宿です。,,,,,,,13093,632,5,p,p,ビールのサービスもポイント高いです。,,,,,,1,3094,632,6,Z,Z,また泊まりに行きます。,,,,,,,1,,,,,,,,,,,,3095,633,1,p,p,仕事での利用でしたが、飲み会があり、チェックインが深夜になってしまいましたが、丁寧に対応いただきました。,1,,,,,,3096,633,2,p,p,フロントは清潔感があり、なんといっても食事（バイキング形式）は魅力的です。,,,,,,1,3097,633,3,p,p,メニューは豊富で、味もお値段以上のものです。,,,,,,1,3098,633,4,p,p,"早めに予約をしたので、朝食込みで4,500円ですが、コストパフォーマンスは高いと思います。",,,,,,1,,,,,,,,,,,,,3099,634,1,p,p,部屋清潔。,,,1,,,,3100,634,2,p,p,狭すぎず、立地も良い。,,1,1,,,,,,,,,,,,,,,,3101,635,1,p,Z,駅から歩いて５分足らず。,,1,,,,,3102,635,2,p,p,他のホテルに比べて近いですね。,,1,,,,,3103,635,3,p,p,食べるところも周りにあり、隣のイトーヨーカー堂が夜遅くまで空いているので便利です。,,1,,,,,3104,635,4,p,p,部屋もきれいで対応も親切でした。,1,,1,,,,3105,635,5,Z,Z,また利用させていただきます。,,,,,,,1,,,,,,,,,,,,3106,636,1,p,p,新しいホテルで清潔で安心して過ごせました。,,,1,,,,,,,,,,,,,,,,3107,637,1,p,p,フロントの対応良いですね。,1,,,,,,3108,637,2,p,p,朝食も美味しく、対応して頂いたおばさんも親切な方で嬉しかった。,,,,,,1,3109,637,3,p,p,また宿泊したいホテルですね。,,,,,,,1,,,,,,,,,,,,3110,638,1,p,p,立地条件が良く、とてもきれいな部屋で気持ちよく宿泊することができました！,,1,1,,,,3111,638,2,p,p,フロントの方も大変感じが良かったです。,1,,,,,,3112,638,3,Z,Z,また機会がありましたら利用させて頂きます。,,,,,,,1,,,,,,,,,,,,3113,639,1,Z,Z,今回で三回めだったそうです、、。,,,,,,,13114,639,2,p,p,今回は一人だったので、心細い思いするかと、ちょっと心配してましたが、十分楽しめました。（周りは全て、カップルだった）,,,,,,,13115,639,3,p,p,一人でも、ゆったりと時を過ごすのには、ぴったりのホテルです。,,,,,,,13116,639,4,p,p,食事は、名の知れたレストランのコースより断然美味しいです。,,,,,,1,3117,639,5,p,p,ドレッシングや、ソースも一味違います。,,,,,,1,3118,639,6,p,p,近いなら、食事だけでも行きたいくらいです。,,,,,,1,3119,639,7,p,p,パン、ヨーグルト、はちみつ、ジャム、、◎。,,,,,,1,3120,639,8,Z,Z,今のまま変わらずに、、次回また楽しみにしています。,,,,,,,13121,639,9,Z,Z,ありがとうございました。,,,,,,,13122,639,10,y,Z,追伸、部屋にＴシャツを忘れてきたようです、お手数ですが処分お願い致します。,,,,,,,1,,,,,,,,,,,,3123,640,1,p,p,かなりの方が書かれてる通り、フロントの方々の対応は本当に素晴らしいと思った。,1,,,,,,,,,,,,,,,,,,3124,641,1,p,p,新横浜駅から近く、部屋もきれいでした。,,1,1,,,,3125,641,2,p,p,この条件で、この価格は大変満足です。,,,,,,,13126,641,3,Z,Z,次回も利用しようと思っています。,,,,,,,1,,,,,,,,,,,,3127,642,1,p,p,寝具やパジャマの清潔感、ユニットバスながら体を洗い易く設計してあるシャワーカーテンレールのアール、衣類の消臭剤や空気清浄機など、アメニティと家電設備に細やかな配慮と清潔感が感じられ、とても心地よく滞在できました。,,,1,1,1,,3128,642,2,p,p,コンパクトなお部屋ながら窮屈な感じは全くせず、広いベッドでのんびりでき、室内照明もいい感じでした。,,,1,,,,3129,642,3,p,p,あまり東京周辺にいくことがありませんが、浅草観光にはとてもいい立地です。,,1,,,,,3130,642,4,p,p,ぜひまた利用したいホテルです。,,,,,,,1,,,,,,,,,,,,3131,643,1,p,p,夜遅い到着にもかかわらず温かい笑顔で迎えていただき、癒されました。,1,,,,,,3132,643,2,p,p,部屋もとても清潔で、予約の必要な朝食を、当日急に申し込んだのに快く作っていただき値段の安い割に豪華でした。,1,,1,,,1,3133,643,3,p,p,とても満足な宿泊となりました。,,,,,,,13134,643,4,Z,Z,ありがとうございました。,,,,,,,1,,,,,,,,,,,,3135,644,1,p,p,素敵なホテルでした。,,,,,,,13136,644,2,p,p,一番お手頃なプランで利用させて頂きましたが、スタッフの方の気さくで温かな対応はとても気持ちのいいものでした。,1,,,,,,3137,644,3,p,p,お部屋もお掃除が行き届いていて、館内に生けてあるお花もお心遣いが感じられました。,,,1,,,,3138,644,4,p,p,７階のお風呂からの景色もよく、女性の方は特に日が落ちる前（富士山がよく見えます）のお風呂がオススメだと思いました。,,,,,1,,3139,644,5,Z,Z,また利用したいと思います。,,,,,,,1,,,,,,,,,,,,3140,645,1,p,p,ルートイングループということもあり、安心して宿泊できました。,,,,,,,13141,645,2,o,Z,今回は楽天トラベルを利用して予約したのですが、ルートインのホームページよりもなぜ楽天からのほうが安く予約できるのでしょうか？,,,,,,,13142,645,3,Z,Z,逆ならまだわかりますけど・・,,,,,,,1,,,,,,,,,,,,3143,646,1,p,p,立地もよく、部屋もきれいで、料金に比し割安感がありました。,,1,1,,,,,,,,,,,,,,,,3144,647,1,Z,Z,初めてこちらを利用しました。,,,,,,,13145,647,2,p,p,新南口ということで少し歩きましたが、改札出てすぐだったので非常にわかりやすいです。,,1,,,,,3146,647,3,p,p,部屋や浴室は十分な広さがあり、とても過ごしやすかったです。,,,1,,1,,3147,647,4,p,p,朝食は渋谷珈琲研究所を利用しましたが、数種類から選択できるのが嬉しかったです。,,,,,,1,3148,647,5,p,Z,また機会があればぜひ利用させて頂きます。,,,,,,,1,,,,,,,,,,,,3149,648,1,p,p,バイキング形式の朝食やロビーの無料パソコンなどとても使い勝手のいいホテルです。,,,,1,,1,,,,,,,,,,,,,3150,649,1,p,p,シングルでの予約でしたが、ダブルのお部屋をご用意していただき、ゆっくり寛ぐことができました。,,,1,,,,3151,649,2,Z,Z,ありがとうございました。,,,,,,,1,,,,,,,,,,,,3152,650,1,p,p,良い部屋を割り当てて頂き、ありがとうございました。,,,,,,,13153,650,2,p,p,フロントの方も親切で好感持てました。,1,,,,,,3154,650,3,p,Z,毎回利用しておりますが、今後も継続して利用したいと思います。,,,,,,,1,,,,,,,,,,,,3155,651,1,p,p,コストパフォマンスは文句なしです無料の朝食であの種類の多さには感動ものでしたパンがとてもおいしかったですまた利用したいと思えるホテルでした,,,,,,1,,,,,,,,,,,,,3156,652,1,p,p,きれいなホテルだし、従業員さんは親切だし、値段も手ごろですごく助かりました。,1,,1,,,,3157,652,2,p,Z,また是非使わせて下さい。,,,,,,,1,,,,,,,,,,,,3158,653,1,p,p,朝食のスープが本当においしかった。,,,,,,1,3159,653,2,Z,Z,また泊まりたいと思います。,,,,,,,1,,,,,,,,,,,,3160,654,1,o,Z,この周辺はホテルが少なく困っていました。,,,,,,,13161,654,2,o,Z,ルートインがお気に入りだったのですが、予約がとれない時がたびたびありました。,,,,,,,13162,654,3,p,p,今回第二ができたことで、予約がとれやすくなり、感謝しています。,,,,,,,13163,654,4,Z,Z,また宜しくお願いいたします。,,,,,,,1,,,,,,,,,,,,3164,655,1,p,p,１２月３１日から１泊利用で初めて利用したホテルですが、大変快適に過ごす事ができました。,,,,,,,13165,655,2,p,p,申込みをしてから数回プランを変更し、問合せをする事があったのですがフロントの方に大変良く対応して頂きました。,1,,,,,,3166,655,3,Z,Z,ありがとうございました。,,,,,,,13167,655,4,p,p,スペースワールドカウントダウンパス＆朝食付きのプランでしたが、食事も美味しくキレイなホテルでぐっすり休む事ができてその上リーズナブルで、大満足の年末年始でした。,,,1,,,1,3168,655,5,p,Z,また機会がありましたらぜひ利用したいと思います。,,,,,,,1,,,,,,,,,,,,3169,656,1,Z,Z,この度はお世話になりました。,,,,,,,13170,656,2,p,p,玄関での出迎えやサービスなど、ゆっくり過ごすことができました。,1,,,,,,3171,656,3,p,p,食事にはとても満足しました。,,,,,,1,3172,656,4,Z,Z,また利用したいと思います。,,,,,,,1,,,,,,,,,,,,3173,657,1,p,p,駐車場が出し入れしやすく立地場所も良くまた利用したい,,1,,,,,,,,,,,,,,,,,3174,658,1,Z,Z,３月２８日に一泊させていただきました。,,,,,,,13175,658,2,p,Z,口コミを見て決めたのですが、大正解でした！,,,,,,,13176,658,3,p,p,朝食もよかったですし、ランドリーも使い勝手がよく、柔軟剤をたくさんの種類から選ぶことができるサービスもうれしかったです。,,,,1,,1,3177,658,4,p,p,全体的に清潔感があってとても気持ちよく過ごせました！,,,1,,,,3178,658,5,Z,Z,また石垣に行くときはお世話になりたいです。,,,,,,,13179,658,6,Z,Z,ありがとうございました。,,,,,,,1,,,,,,,,,,,,3180,659,1,Z,Z,息子（小学6年生）と二人で一泊しました。,,,,,,,13181,659,2,p,p,チェックインの際の対応が物凄く気持ちがよく、息子との小旅行がとっても良いものになりました。,1,,,,,,3182,659,3,p,p,息子も子供ながらにも気分が良かったのでしょう。,,,,,,,13183,659,4,p,p,「フロントのおじさん研修生って書いてるけどとっても笑顔で対応してくれて気持ちがいいね」と言っておりました。,1,,,,,,3184,659,5,p,Z,あの時の吉田さんありがとう！,,,,,,,1,,,,,,,,,,,,3185,660,1,Z,Z,家族４人で２泊させていただきました。,,,,,,,13186,660,2,p,p,スタッフの方は、函館観光のポイントを親切に教えてくれたりと、サービスがとても良かったです。,1,,,,,,3187,660,3,p,p,部屋は和室で、落ち着く部屋でした。,,,1,,,,3188,660,4,p,p,家族でゆっくり過ごせました。,,,,,,,13189,660,5,kp,p,お風呂のお湯はかなり熱めですが、露天風呂は水で薄めるとすぐに気持ちの良い温度になり、子供も満足そうでした。,,,,,1,,3190,660,6,p,p,四ヶ月の赤ちゃん連れだったのですが、私と上の子が洗っている間、地元の方が下の子を抱いていてくれて、その人の温かさがとてもうれしかったです。,,,,,,,13191,660,7,p,p,湯の川はとても良いところでした。,,,,,,,13192,660,8,p,p,素敵なおばあちゃんがいる、美味しい団子屋さんもありましたよ。,,,,,,,13193,660,9,p,p,本当にありがとうございました。,,,,,,,13194,660,10,Z,p,また、函館に行く際にはお世話になりたいと思ってます。,,,,,,,1,,,,,,,,,,,,3195,661,1,p,p,大森駅からの立地もよく、なんと言っても羽田空港までの送迎バスが無料で利用出来るなどの便利さもあります。,,1,,,,,3196,661,2,p,p,朝食もバイキングになっており最高でした。,,,,,,1,3197,661,3,Z,Z,また予約したいと思います。,,,,,,,13198,661,4,Z,Z,お世話になりました。,,,,,,,1,,,,,,,,,,,,3199,662,1,p,p,素泊まりの料金で朝食付きでホテルでゆっくり出来たのが非常に良かった。,,,,,,1,,,,,,,,,,,,,3200,663,1,Z,Z,結婚２７年の記念として利用させていただきました。,,,,,,,13201,663,2,p,p,部屋も白良浜が一望のオーシャンビューで最高でした。,,1,1,,,,3202,663,3,p,p,料理もとても美味しく、サービス係のきめ細かいサービスも今までに泊った旅館と比較できないほど素晴らしいものでした。,1,,,,,1,3203,663,4,p,p,選べる色浴衣などのサービスやお風呂に入っては、湯ざましに本を読むなどを繰り返し本当に何もしない贅沢を楽しみました。,1,,,,1,,3204,663,5,Z,Z,ありがとうございました。,,,,,,,1,,,,,,,,,,,,3205,664,1,p,p,海老名駅から近く、コンビニも近くにあり使い、便利だと感じました。,,1,,,,,3206,664,2,Z,Z,来年もまた利用したいと思います。,,,,,,,1,,,,,,,,,,,,3207,665,1,p,p,朝ごはんが良かったです,,,,,,1,,,,,,,,,,,,,3208,666,1,Z,Z,子連れで宿泊しました。,,,,,,,13209,666,2,p,p,客室が多くないので、とても静かで、窓からの景色のうつりかわりを楽しみながらのんびりと過ごせました。,,,1,,,,3210,666,3,p,p,お風呂も露天風呂・カメ風呂といろいろ楽しめて良かったです。,,,,,1,,3211,666,4,p,p,いいタイミングだったのか、ほとんど貸切状態でゆったりでき最高でした。,,,,,,,13212,666,5,p,p,日ごろの疲れがとれ、熟睡できました。,,,,,,,13213,666,6,p,p,朝のラウンジルームでは親子でジュースやお茶をいただき、朝食前にくつろいだ時間を過ごせました。,,,,,,1,3214,666,7,p,p,どのスタッフの方も、子どもにやさしく声をかけて下さって安心でした。,1,,,,,,3215,666,8,p,p,食べるのにまだまだ手のかかる子どもがいても、夕食・朝食とも部屋食なので落ち着いて食べられてよかったです。,,,,,,1,3216,666,9,Z,Z,またリピートしたいと思います。,,,,,,,1,,,,,,,,,,,,3217,667,1,p,p,チェックイン時間が翌日の朝になったりしても、気持ちよく対応してくれました。,1,,,,,,,,,,,,,,,,,,3218,668,1,Z,Z,福岡空港集合のツアー前日に母とツインの部屋に泊まりました。,,,,,,,13219,668,2,p,p,博多駅に近く空港へスムーズに行くことができました。,,1,,,,,,,,,,,,,,,,,3220,669,1,p,p,コーヒーとアメニティのサービスが良かったです。,,,,1,,1,3221,669,2,p,p,立地が良いうえ、駐車場が無料なので満足しました。,1,1,,,,,,,,,,,,,,,,,3222,670,1,p,p,玄関からベルの方に親切にご案内いただき、フロントの方もレストランの手配をしてくださったり、細やかにご配慮いただきました。,1,,,,,,3223,670,2,p,p,BARは居心地良く長居してしまいました。,,,,,,1,3224,670,3,p,p,お部屋の調度も眺望も素晴らしく、ゆっくり過ごすことができました。,,,1,,,,3225,670,4,p,p,近隣にいくつかホテルがありますが、こちらを選ばせていただいて本当に良かったです。,,,,,,,13226,670,5,Z,Z,次回もよろしくお願いいたします。,,,,,,,13227,670,6,Z,Z,ありがとうございました。,,,,,,,1,,,,,,,,,,,,3228,671,1,p,p,駅から近い。,,1,,,,,3229,671,2,p,p,地下道の出口がわかっていれば雨が降ってもほとんど濡れずに来ることができる。,,1,,,,,3230,671,3,p,Z,朝食は300円でりっぱな朝食が食べれるが、私のようにごはんとみそ汁があれば十分という人間には無料朝食で十分。,,,,,,1,3231,671,4,p,p,ちなみに、ここのお米はビジネスホテルにしては珍しくおいしいお米を使っていると感じました。,,,,,,1,,,,,,,,,,,,,3232,672,1,p,p,仕事先に近く便利でした。,,1,,,,,3233,672,2,p,p,チェックイン時ミネラルウォーターのサービスもありがたかったです。,1,,,,,,3234,672,3,p,p,部屋も綺麗で清潔でした。,,,1,,,,3235,672,4,Z,Z,また宿泊します。,,,,,,,1,,,,,,,,,,,,3236,673,1,p,p,朝食が7時前からできたのでゆっくりできました。,,,,,,1,3237,673,2,p,p,バイキングもうれしいです。,,,,,,1,,,,,,,,,,,,,3238,674,1,p,p,京都駅に近くコンビニ、家電店もそばにあり便利,,1,,,,,,,,,,,,,,,,,3239,675,1,Z,Z,正月明けの連休に利用させて頂きました。,,,,,,,13240,675,2,o,Z,天気も良く、富士山も綺麗に見え、部屋の露天風呂から景色が見られればと思ったのですが、柵があり、景色は見えませんでした。,,,1,,1,,3241,675,3,py,p,部屋もお風呂も大変満足させてもらったので、景色があれば、なお最高でした。,,,,,1,,,,,,,,,,,,,,3242,676,1,p,p,ホテル周辺はどこでも絵を描く為のスポットになり白馬の紅葉の景色など何枚も思い出に残る作品が出来て良かった。,,1,,,,,3243,676,2,p,o,本当に白馬はいい所です。,,,,,,,1,,,,,,,,,,,,3244,677,1,Z,Z,3月31日に宿泊致しました。,,,,,,,13245,677,2,p,p,とても満足しております。,,,,,,,1