420	2804	I had a great experience with my previous 330i and didn't think there was much room for improvement
420	2805	The 2009 335i takes an already near perfect design and adds just a little more in a lot of area
420	2806	The engine is something you just have to experience by driving the car
420	2807	Great power at all speeds and seems to beg to be driven harder
420	2808	The handling is great in the curves
420	2809	The new iDrive is fantastic
420	2810	This is not the sluggish iDrive system of the past
420	2811	If you are into tech toys and can operate a modern cell phone you will love the new iDrive
420	2812	If you like performance cars go test drive one
420	2813	Just be prepared to want one.
421	2814	This is not a sports sedan
421	2815	It is a small, efficient urban two passenger transport that has a small footprint but a spacious interior
421	2816	Being a Daimler product it has the safety and quality expected
421	2817	Having a small Mitsubishi engine, it is no surprise the performance and reliability it has
421	2818	Being a European design, it has character and head turning style
421	2819	Over all this little car has fulfilled and surpassed every design objective and it is fun to drive around town
421	2820	It is priced well for the market.
422	2821	Great ride, love the navigation, easy to use
422	2822	Seems to shift strange
422	2823	Mileage has not been as good as promised
422	2824	Good looking and fun to drive
422	2825	Have had many compliments on this vehicle from strangers in parking lots
422	2826	Cannot believe that the back bumper is not real chrome
422	2827	For the price of this vehicle it should be real chrome not paper.
423	2828	Bought the 2009 R/T R package (Road and Track) - I think it is well worth the extra money - improved handling and the top line seats - only drawback they are (or at least at the time I bought) very hard to find
423	2829	So far the car is great to drive - very comfortable on road trips - I can drive all day long
423	2830	I also bought the upgraded sound system (Boston), best sounding factory installed system I have ever had
423	2831	I live in Wisconsin, drove once in the snow earlier this year and I am planning on driving year round - from what I have experienced car should handle as good as any non 4X4 - just have to drive with common sense! Dodge rebates plus lifetime warranty backed by the gov't sealed the deal
424	2832	This new CTS made it even less painful to get rid of my old (2006) CTS
424	2833	This car is pure pleasure for me
424	2834	I love everything about it except the fact that it feels so smooth while I am driving it that I don't realize that I am going so fast
424	2835	I loved my old one but this one stands out by far! Would suggest this car for anyone who is looking for a luxury thrill
424	2836	The only thing this car doesn't do is make me coffee but it has a button for that and will direct me to the nearest Starbucks.
425	2837	Just purchased this car for my wife, we researched and test drove the Camry, Fusion, and Mazda6 as well but selected the Altima
425	2838	It has what we felt was the best finishing details/trim and was sportier than the Camry and Fussion
425	2839	The Mazda6 was a close 2nd place but our local dealer didn't have much of a selection
425	2840	We have owned Mazda 626 and a Camry in the past and really like both of them, but the Altima just fit our needs better this time
425	2841	Probably a little more in price when equipped comparably, but worth the extra $$
425	2842	We love it so far.
426	2843	My wife drives 20k miles/yr on business
426	2844	She's put 90K on a Grand Marquis in 4.5 yrs
426	2845	She likes my 08 Santa Fe, but wanted something more stylish with a high sitting position
426	2846	She loves the Venza! High style, room of an Avalon for adult business associates and friends, space for occasional hauling projects
426	2847	An Avalon wagon!
427	2848	Midyear model in midnight sky was the car I wanted after reviewing everything I could about the nissan vs.mazda3,honda civic and toyota corolla
427	2849	Had it two weeks now and very happy about choice
427	2850	Great price too(rebates from dealer and nissan to dealer in addition to 4500 cars voucher) made it a no brainer
427	2851	Interior comfort and roominess was best of the group
427	2852	"I am 6'2"" and interior size was important"
427	2853	Great acceleration and smooth,seamless transmission, Handling is pretty good and quiet for a small car
427	2854	The only negative comments I can make is the oddly shaped rearview mirrors and security alarm going off when unlocking trunk without unlocking doors first
427	2855	Otherwise s solid choice.
428	2856	I am pleased with most things about this SUV
428	2857	It gets over 25 MPG on the Hwy with average speed of 70 MPH, but in town I am very disappointed
428	2858	In normal city driving it gets 13 to 14 MPG.
429	2859	Had for 6 months and have put 4,000 miles on it
429	2860	Had a 2006 sportage and saw the optima and had to have it
429	2861	I am blown away at the attention it gets
429	2862	People are always telling me they love its looks and the red color is sharp
429	2863	I just smile when I pull up beside a accord or Camry and think to myself I saved thousands and have an equal car
429	2864	The optima feels smooth and plenty of power from the I-4 it only has a few less horse power than the v-6, save a few bucks and buy the I-4
429	2865	The trunk really holds a lot and the car is comfortable on long trips
429	2866	The gas mileage is as advertised which many cars do not match up
429	2867	So we are very pleased
429	2868	We do recommend kia to everyone we know.
430	2869	We just picked up the new 2009 SE-G Challenger
430	2870	She's a sweet, boss looking ride
430	2871	The 1st one off the rail car from the factory, and we got her! Inferno pearl red is a head turner at every light in town
430	2872	The base MSRP, 09 Challenger is nice, but the dealers are still trying to sell them like the numbered SRT*8, 08's
430	2873	The 3.5 high output V6 is not very quick off the line, but very quick to respond after you'er out of 1st gear
430	2874	The car feels well balanced and can scream around bends and turns like the best of them
430	2875	Outstanding road feel and a rocket on the Hwy
430	2876	The G package ( 26G )has larger rims, fog lights, all speed traction control, 4 wheels ABS disc brakes, electronic stability program
431	2877	After driving the Mazda6, none of the other cars I tested (Altima, Accord, Legacy, Camry) could match the combination of features/performance/style
431	2878	The acceleration is better than I expected with a 4cyl and the suspension has an excellent balance between handling and comfort
431	2879	The Michelin tires do squeal too early though
431	2880	The dashboard is very intuitive and easy to use
431	2881	The GT has more features than I know what to do with
431	2882	I especially love the blue tooth connection for my cell phone
431	2883	The only minor disappointment is the gas mileage
431	2884	After 2 months, I'm only getting 21 mpg in combo city/highway driving but that's a small price to pay for an excellent car.
432	2885	I've had my Journey for 3 months and already have had the sunroof, power steering, transmission, and main wiring harnesses worked on
432	2886	The oil light came on before 3000 miles and I got the recall about the wiring harness about the same time
432	2887	I made an appointment and had the service department look to see why the car made a load noise when turning left
432	2888	The Power steering was replaced and the transmission started slipping between 1st and 2nd gear also gets stuck in 5th gear and causes my mpg to be about 16.5
432	2889	Now the the dealership is leaving it up to Chrysler to figure out.
433	2890	I first got into Toyota in my 2000 Avalon XLS
433	2891	Then my 2003 Avalon XLS
433	2892	In Oct.07, I bought a 08 Camry SE
433	2893	I just traded it for my 09 Avalon Limited
433	2894	I would ask why buy a bottom end Lexus, this high end Avalon is perfect
433	2895	The room in it is exceptional and it has all the comfort features you could want from a luxury car
433	2896	The price points of Toyota are exceptional and have better negotiations than Lexus by far
433	2897	Toyota warranties are not as good as Lexus but then they don't break either
433	2898	Toyota, thank you for making such a GR8 car! I love it.
434	2899	I love my corolla! It's fun and easy to drive
434	2900	The car handles well, gets 30 mpg routinely, has cold ac, and the JBL stereo is great
434	2901	I think the interior dash design could be upgraded, but that's my only complaint
434	2902	With the reliability of Toyota, I'm sure I will be driving this car for many years to come.
435	2903	I have only had my 370z for 2 days now and it is the best one yet
435	2904	I have owned a 1978 280z, 1984 300z, 1991 twin turbo z, 2003 350z, and now the 370 and all where great but none compare to 370! If Nissan keeps getting this car right at this kind of price I will still be driving a z when I'm 80 yrs old.
436	2905	Comfortable car, good to drive powerful 3.5L with V6 engine
436	2906	compare to Nissan Maxima and Altima v6 engine and Honda Accord
436	2907	I'd rather buy Toyota Camry a little cheaper price and the model look good too 
437	2908	Our experience with this car has been nothing but positive
437	2909	We are military so we drive from Florida to Texas once a year(about 1,000 miles)
437	2910	On our trips(we've gone twice so far), we average about 40 MPG
437	2911	Once we even got 42 MPG!!! The cabin is very quiet and I can actually speak in my normal voice! I love the bluetooth feature
437	2912	Since we live on a military base, driving while on the phone is illegal and can cause us major trouble
437	2913	I love how quiet it is at stop lights
437	2914	I can hear myself think!! This car is reliable, and beautiful inside and out
437	2915	I also love the 6 cd changer and the separate temperature control
437	2916	We couldn't have made a better decision !
438	2917	Well I recently purchased my Vue hybbrid to help me lower my fuel costs
438	2918	I have to drive 270 miles a day round trip for my job
438	2919	I needed a vehicle that was roomy enough for me and woulld improve my mpg's
438	2920	Most of my trip is on the highway
438	2921	This vehicle has cut my fuel costs in half
438	2922	I was getting about 14MPG in my Jeep GC and am now getting 31MPG in the vue hybrid
438	2923	I live in the Catskill mountains of New York and have to drive down to the office in New Jersey
438	2924	This vehicle has done well even in the mountains
438	2925	I hope the vehicle will be reliable considering the high mileage I will be putting on it
438	2926	About 1200 miles a week.
439	2927	This is my third Avalon
439	2928	I am still getting used to it but overall, I really like it
439	2929	It has a great ride and is very quiet
439	2930	The only thing I do not like is the hardness of the drivers seat
439	2931	I can feel something under the padding, perhaps it has something to do with the seat's cooling feature
439	2932	I have been driving around for the last 4 months with a thin quilt under me
439	2933	This makes it more comfortable
439	2934	Hopefully the seats will break in and I can take out the quilt
439	2935	Other than that, I really love it.
440	2936	I love my Lancer
440	2937	I went to the dealership not thinking that this car would be what I wanted, and I actually had an appt
440	2938	with an Infiniti dealer the same day
440	2939	After test driving this car I fell in love with it
440	2940	The pickup is great in the 2.4 and the ride is quiet
440	2941	I have the dark gray and people think it's the small BMW! I trade my cars in every 2-3 year (lease) and always went for the high end 6 cylinder cars
440	2942	This car is just as good if not better
440	2943	I love driving it, the ride is really wonderful!
441	2944	We replaced my wife's 2002 Mazda Tribute with this after a great deal of research
441	2945	Love the quality and build
441	2946	Very comfortable; rides like a car not a truck
441	2947	The Premium sound system in the Limited is among the best I've ever heard (and I drive Lexus) Satellite Radio is nice extra that's standard
441	2948	What sold us, too, was the outstanding warranty
441	2949	V6 engine is quite sufficient for this vehicle and auto trans is smooth
441	2950	Overall, very pleased with this purchase and the $2000 incentive from Hyundai made the purchase of this cost about as much as the Tribute did 7 years ago! 
442	2951	There have been many complaints about this being a rebadged Chrysler
442	2952	For what it is, the Routan is outstanding
442	2953	There is no way to get a Wolfsburg designed and built minivan to the U.S
442	2954	in this price range
442	2955	VW is trying to capture the market for their customers who already have a VW and need a family hauler
442	2956	We have a Jetta, and needed more room for our growing family
442	2957	"While every aspect of it may not be ""German Engineered,"" it surely is ""German Inspired."" The ride is great, the layout inside is well though out (we have a bench instead of the captain's chairs for the 2nd row, much more convenient in my opinion)"
442	2958	Would definitely recommend
443	2959	I have had this truck for around a month now and I am very impressed
443	2960	It flat moves and is stable doing so
443	2961	I purchased it to replace a 2002 C class MB that I loved but missed having room to haul anything
443	2962	So far it's two thumbs up! Anxious to take a road trip in the next 2 months
443	2963	Vegas to Denver should be a good test
443	2964	Maybe a bit of off road testing hopefully
443	2965	The gas millage isn't anything to write about at this point but it's only got 1000 miles on it
443	2966	It feels like a Benz..
443	2967	That's the best part!
444	2968	I haven't had this truck for very long but I am impressed with it so far
444	2969	It rides smoothly, has good fuel economy, and is very fun to drive
444	2970	It has a lot of power for its size
444	2971	Its handling is tight and is easy to move in tight spaces
444	2972	Over all it's a dependable little workhorse.
445	2973	Another great Subie
445	2974	I have an 08 Outback and a 09 WRX
445	2975	Fast?....oh yea! Handles like a rally car and goes in the snow
445	2976	The best of both worlds, along with Subaru's legendary reliability
445	2977	Getting on the freeway is always exciting, 0 to 100 in a flash...I'm in my sixties now and am loving the exhilaration of having a race bred rocket, with the drive- ability for all weather conditions
445	2978	A great value from the folks at Subaru
445	2979	Gas mileage? If that's a concern, buy a Prius
445	2980	Purchased with the SPT Cat Back exhaust, Short Throw Shifter and Turbo Gauge.Interior Foot-well Lights are a very cool touch
446	2981	Yes, the best vehicle I've purchased in my 45 years buying new and used cars
446	2982	Zero defects, outstanding mileage
446	2983	I think it combines the best combination of mileage, safety, capacity, and price of any vehicle in the U.S
446	2984	market today
446	2985	Its $3,000 income tax rebate made it a $25,600 purchase price for me plus tax and tag
446	2986	Noticeable improvements over the 2008 model I test drove early in the year
446	2987	You could coast for a long time between 35 and 40 mph on electric alone! Mine is still on break-in and the average mileage with AC on half of the time (Miami,FL) is 33.6 mpg
446	2988	This is on a mix 50% suburban, 30% city, 20% highway; and American made to boot.
447	2989	Went from a 2001 BMW X5 to a BMW 330i and now back to a 2009 X5
447	2990	Needed the X5 to pull a boat, which it does with ease
447	2991	The 2009 is much improved over the 2001 in terms of build quality
447	2992	The 2001 X5 did have mechanical issues
447	2993	I do miss the handling of the 330i but for a SUV, the 2009 X5 is as close as it gets!
448	2994	This is my first new car and I really like it
448	2995	I was testing 2008 altima coupe 2.5s and Honda accord coupe exl
448	2996	Even though I like the long term reliability of Honda but I like the style and performance of altima coupe
448	2997	It is much quite than the Honda accord
448	2998	I would recommend this car to anyone who likes the sport car
448	2999	Accord coupe is also a beautiful car but I think it is still like a family car
449	3000	We have 3 kids and couldn't see affording $30,000+ for a new minivan or a cross-over
449	3001	This car was much more affordable and will cost much less to maintain
449	3002	It rides like a car, but has a interior layout like a minivan
449	3003	We won't be able to tow a boat or carry an 8' wide piece of plywood, but we never did when we had that capability with our previous minivans
449	3004	The kids love it, but we haven't taken the first vacation in it yet, so we may be sacrificing on space and power when the car gets fully loaded with luggage
449	3005	I'm a tall guy and I push the limits on most cars
449	3006	Leg room and head room could be better, but I fit and I like the feel when I drive.
450	3007	The CR-V is my first SUV
450	3008	It was purchased to deal with the deep winter snows we've been getting here more often
450	3009	So, while I'm most interested in utility, finding that the CR-V really handles well, has great road feel and peppy performance is an unexpected bonus
450	3010	Gas mileage is higher than I expected, too
450	3011	This is a thoroughly excellent vehicle.
451	3012	Althrough I've had this car for only a short time, less than three weeks, I did drive a 2008 Impala for a year (company car)
451	3013	Because of the pleasant experience with the '08 I decided to buy an '09 when I had to return the company car
451	3014	However I find the 2009 to be extremely uncomfortable as compared with the 2008, specifically the lumbar
451	3015	It doesn't deflate all the way as it should, and it really really hurts my back (and others who have driven my car)
451	3016	This seems to be the way it is on all 2009's
451	3017	"(No problem with the 2008's.) I've been told ""this is the way it is"" and nothing can be done"
451	3018	This flaw should be corrected but I suspect it will not be because it's not a safety issue.
452	3019	This is an amazing great car with unmatched value
452	3020	My wife and I absolutely love it
452	3021	Our friends are very impressed
452	3022	We've owned it for 4 months and I waited until now to do the review
452	3023	At 3500 miles, with majority (~80%) highway driving, the long-term mileage has been 24 mpg
452	3024	As the flagship for Hyundai until the Genesis, one clearly senses that a whole lot of thought had gone into the design, and care into the build of this car
452	3025	So far, this has been the most issue-free car I've owned, including Camrys and Accords
452	3026	There are people who would rave about this car if it was a luxury brand, but are more reserved as a Hyundai product
452	3027	The Azera should be continued, to convert these skeptics
453	3028	I bought a CRV after reading reviews here and Consumer Reports
453	3029	I have been very happy with the car since buying it
453	3030	It feels very well put together and is comfortable to drive
453	3031	It's not a Maserati but that wasn't what I was looking for
453	3032	I just wanted basic transportation, reliability, and a price that I could afford
453	3033	I'm definitely happy to own this car and I expect many years of use.
454	3034	After more than 6 months of driving my 09 TCH I still think it's one of the best cars I have ever owned
454	3035	I was getting between 34-42 MPG when I first got it, but that was being easy on the gas peddle, now, with much more aggressive driving, I'm getting 28-34 MPG
454	3036	Still impressive for a large car
454	3037	I just found out my car ins
454	3038	for the hybrid is HALF the cost of the Highlander I traded in! 
455	3039	If you want to save on gas but still want to buy something that's has some style to it, this is your car
455	3040	I loved the redesigned look of the latest Camry when it out, and this new 2009 corolla is like a smaller version of the Camry
455	3041	The exterior of the S model is beautiful in person, most pictures don't do it justice I think
455	3042	The interior is nice and there is plenty of room for a family of five
455	3043	Myself, my wife and our 3 girls (one who is still in a safety-seat)
455	3044	The JBL stereo upgrade is well worth it, it sounds great with plenty of deep bass, and the added Bluetooth support that comes with it is a God sent
455	3045	We are so glad we chose the Corolla, it fits us just fine!
456	3046	Just purchased the new 2009 Venza, 3.5, V6, AWD, Black with roof rack, cloth seats on 24 June 2009
456	3047	A nice looking ride and easy to dive
456	3048	Fuel economy supposed to be 18 to 25 MPG
456	3049	Just a few days the best MPG so far is 12.5
456	3050	Also seating is very firm and hard on the bottom
456	3051	Suggest future years Toyota put in a more comfortable seat
456	3052	In addition, suggest this great looking car have memory front seating for the driver and passenger
456	3053	I've read all the reviews on this vehicle and many other people have stated the same recommendations: (memory seating to include side view mirrors and more comfortable seating
457	3054	The styling of this car sets it apart from all others in its class
457	3055	This is our second BMW and I'm a hard sell for import cars
457	3056	BMW gets greedy with there options they are priced to high and there is no such thing as a base model on the lot
458	3057	I love my Forester
458	3058	I find some of these reviewers asking for things that are available if you are able/willing to pay for it
458	3059	I searched many other cars and found that Subaru's AWD is by far the most reasonably priced
458	3060	If you want a great stereo and lumbar support, don't go with the base
458	3061	However, if you want decent payments on a reliable SUV, go for the base
458	3062	It is a great vehicle that handles well, steering is responsive and I never feel as though my safety is compromised
458	3063	I love my car.
459	3064	Just picked up my wife's 2009 Alpine Gray tiguan with nav and panoramic roof
459	3065	Wow! This vehicle is fast 
459	3066	Stops on a dime
459	3067	And is surprisingly comfortable
459	3068	"My wife keeps referring to it as ""awesome"""
459	3069	She loves it 
459	3070	It is a gti in disguise! In my opinion
459	3071	Build quality is superb! VW and Audi have a winner on their hands in my opinion
459	3072	Not for the faint of heart! A must drive before you buy anything else!
460	3073	Let me start with I checked out just about everything out there in this price range and took my time making a decision as I did not need a new car but rather wanted one
460	3074	After looking for over a year I decided on the Honda Civic EX 5 speed and so far am very happy with it
460	3075	The car rides nice and handles very well for what it is (I had Miata's, and MG's before this) the deciding factor was the Honda's resale value compared to everything else
460	3076	If you are looking for a well built, fun to drive and reasonable cost to operate car look at the Honda Civic! The EX model has all the toys you need, sunroof, 4 wheel disc brakes, cruise, and a decent stereo system
460	3077	I paid 17,451 including destination
460	3078	Love IT.
461	3079	This is a great truck
461	3080	Just be smart about what you are buying
461	3081	I am really happy with my Ridge
461	3082	I wanted a truck that was reliable, comfortable, and had longevity designed in - not planned obsolescence
461	3083	It is not a big Ford or Chevy - it is a medium sized truck more suitable for a person who values convenience, storage, and intelligence over outright brawn
461	3084	I couldn't be happier as this vehicle fulfills all my needs for a truck - adequate towing, people mover, great ride, good at the lumber yard/garden center - in a 4 wheel drive long lasting Honda package
461	3085	For most of us that want a truck, don't tow more than 5000 lbs, and don't live on a farm, this truck was designed with us in mind
462	3086	This my first Honda purchase
462	3087	"The Fit is the absolute most fun you can have with 115 HP! No matter what speed you are going, there is always more ""get up and go"" when you need it"
462	3088	A high quality small car! Without the high price
462	3089	If you are in the market for a fuel saver but also desire peppy performance with great utility this car is the only way to go
462	3090	Bravo Honda! 
463	3091	I have been wanting this vehicle for the longest time
463	3092	The heavy snowfall in Erie sent my wife and me over the edge and we got the Tacoma
463	3093	Simply love it
463	3094	"Tons of room in the cab for me (I'm 6'3"") and a car seat in the back"
463	3095	This truck handles amazing in the snow and ice
463	3096	I have yet to get stuck..
463	3097	and I have tried! The safety features Toyota put into this truck are really impressive and allow it to handle great in all conditions
463	3098	Lots of power, gas mileage is not the best, however, its much better than other trucks out there
463	3099	All in all, I am very happy with the Tacoma
464	3100	Traded 2001 Passat on my first Acura, not as smooth/quiet of a ride, but for the $$ a good trade off
464	3101	Looking for better reliability along with gas mileage
464	3102	Last 5 tankfuls have exceeded 33 mpg, country driving 45 to 55 mph for 50 miles R/T per day
464	3103	No problems after 4 months
464	3104	A must look for the $$ with many standard features compared to models in the same class
464	3105	Looked at Audi A3/A4 & Honda Accord.
465	3106	This is my fourth Z and is clearly the best in overall performance and can match or outperform almost any sports car on the road
