279	1857	"It does lack in some ""luxury"" things (push button start, HID, etc), but for 22K, can't complain"
279	1858	Great car.
280	1859	I saw the Enclave about a year ago and started my research immediately
280	1860	Compared to all the other sport looking crossovers, with a three pass third row seat, the Buick has the most standard features at a better or comparable price point
280	1861	I had a Tahoe, and I loved it, except for the cargo behind the third row, I couldn't even fit a standard stroller back there, so this time I was looking for the passenger room and functionality, and I found it
280	1862	My kids can easily access the third row
280	1863	It has all the pretty things that I wanted, to include the dual sun roofs and power liftgate
280	1864	It looks hot, drives like a dream, and made all my friends jealous! And, you can't beat the warranty! Thanks!
281	1865	Since buying this vehicle I can't seem to want to park it
281	1866	The feel on the road,acceleration and overall experience is fantastic
281	1867	I love this vehicle
281	1868	It's the nicest car I test drove and believe me I tested them all before the purchase 
282	1869	"Brakes squeak from day one, transmission makes shredding, tearing noises when putting in reverse and then drive, headrest forces your head forward, when full gas tank sounds like a swimming pool sloshing around and already had a safety recall for poor build quality with ""noises"" coming from the back of the car"
282	1870	Road noise is horrible on certain roads
282	1871	You still want to risk buying this car?? My last Honda ever! 
283	1872	I drove the the Camry and Accord when shopping--the Sonata has a much more comfortable ride
283	1873	When pulling up to red lights next to Sonata's competitors, I find myself feeling sorry for them that they settled for less
283	1874	The Sonata is really well thought out in terms of design
283	1875	I couldn't be happier
283	1876	Thank you Hyundai engineers and designers
283	1877	My daughter bought one just six days after I bought mine--different color of course
283	1878	She loves hers too.
284	1879	Just had the car for 3 days and I really enjoy driving it
284	1880	After months of searching for a new vehicle my husband and I finally decided on a new xB
284	1881	The price and being made by Toyota is what sold us
284	1882	We got the fog lamps, rear fin, upgraded wheels, in the new stingray metal
285	1883	Great ride, very comfortable and quiet
285	1884	Got the 5.4 engine as I got a great deal on an advertised package, and the mileage only 1 mpg less
285	1885	Getting about 14 mpg in the city, about the same as my old 97 f150 4.7 v- 8
285	1886	I noticed in consumer reports, they mentioned the truck engine to be a little loud, and the ride a little rough
285	1887	Wow, I would have to disagree
285	1888	This engine and tranny is silky smooth and quiet, everyone comments on that who has been in the truck
285	1889	I test drove some other trucks, but this one really feels luxurious.
286	1890	This car has the absolute WORST driveability of any car that I have recently driven
286	1891	This purchase is a HUGE MISTAKE and I have nothing but REGRETS!!
286	1892	It DOES NOT GO IN STRAIGHT LINE ON THE HIGHWAY!!!!!! It needs CONSTANT, and I mean CONSTANT, steering corrections to keep it going straight ahead
286	1893	So your arms get EXTREMELY tired in a very short time (And yes, I've checked the alignment SEVERAL times)
286	1894	I had a friend's 2000 Geo Metro Hatchback for a couple months last year, and that car tracked waaaayy better (and that's a $1000 car for crying out loud!!!!!!!)
286	1895	It is impossible to take this car on anything more than a half hour drive without feeling your arms are going to fall off!!!
287	1896	Had a 3.0 X5
287	1897	Test drove Audi, Lexus, Acura, BMW gas, and fell for performance of X5 diesel
287	1898	After 7,000 miles I am actually trading it in for MB ML350 diesel
287	1899	BMW just not as comfortable
287	1900	Seats not as supportive
287	1901	Engine can be too loud
287	1902	Satellite radio comes & goes
287	1903	Passenger seat grinds/clicks when moved
287	1904	Steering wheel squeaks when moved
287	1905	Rt side speakers go dead on iPod integration
287	1906	Need to roll the window up/down a few times to get speakers back
287	1907	Steering wheel does not telescope long enough for 6-1 height
287	1908	Engine performance is incredible
287	1909	Second seat leg room is great
287	1910	Cargo space is great
287	1911	Just want more refinement
287	1912	Maybe I am getting old.
288	1913	Great car
288	1914	Excellent acceleration, braking and handling
288	1915	Sound system is awesome and looks are incredible.
289	1916	I've had my new TL for 2 weeks and am in love with it
289	1917	Traded in my 2007 G35x and do not miss it one bit
289	1918	interior is large and fit and finish is top notch
289	1919	reviews regarding steering are not accurate
289	1920	Steering is spot-on and effort is just right
289	1921	controls are intimidating at first but make perfect sense after a few days
289	1922	gas mileage is great for this class, and as far as the styling goes, even stubborn anti-car girlfriend loves it
290	1923	I have just over 8000 miles on my Taco and am very pleased with the truck
290	1924	Adequate power, comfortable ride, good looks and fun to drive.
291	1925	Had the car for 3 weeks now and am pleased with it
291	1926	I never considered buying a Elantra, but friends of ours has 2 and love them
291	1927	I wanted a car that's reliable, safe, good mpg,comfortable and affordable-the Elantra was it! No other car maker came close with the same options & price plus warranty
291	1928	It's not sporty or a head turner,but for me that's ok.
292	1929	I love my Sienna! My friends can't believe that I traded in my BMW M3 for a minivan
292	1930	Being a mom, family safety and comfort was at the forefront of my decision but I started to really like the aesthetics of the minivan
292	1931	I was surprised at the turn radius and also the pep
292	1932	I have to say that I cannot live without the remote sliding doors/trunk, AWD, DVD, and rear camera
292	1933	I've been trading in my old Siennas for a new one every 2 years or so because I love them so much (not because I've had any problems with them)
292	1934	I keep changing colors and haven't yet decided which is my favorite yet
292	1935	I love the AWD and run flat tires (makes me feel safer with the family on board).
293	1936	Traded our Acura TSX for an Audi Q5 and could not be happier with the choice
293	1937	The Audi Q5 does not handle like your normal SUV and it gives us better mileage so far in the City and on Highway driving with way more storage room than the Acura TSX and ability to haul more stuff
293	1938	I would certainly recommend this car to anyone looking for a smaller SUV, a lot of fun, power and style.
294	1939	After studying all the compact SUVs, we decided that the Rogue was just what we needed
294	1940	It had good mileage (for this class of vehicles) and, in fact, we are getting 26-27 in town and close to 30 on the road
294	1941	It has the clearance and AWD we needed for moderate off-the-road usage (wildlife surveys, kayak in-putting, etc.)
294	1942	In addition, it is very comfortable and quite quiet on the highway
294	1943	Handling is better than the other compact SUVs that we tested
294	1944	Reviewers complain about the storage capacity being less than some of the competitors, but we do not need it and appreciate the better looks and handling of the Rogue
294	1945	Bigger is not always better
294	1946	After 4 months and 5K miles, zero defects.
295	1947	We've owned it for over a month and had one long road trip
295	1948	"We've loaded it with 3 passengers and 18 2""x10"" four foot long boards along with a roll of fencing"
295	1949	We love the capacity and functionality of it
295	1950	It was comfortable on the trip
295	1951	Gas mileage was decent, but a 5 speed auto would be great
295	1952	We've been getting ~26mpg and that's mostly around town including a carpool line
295	1953	Considering it is a compact car, it's a great car for a small family
295	1954	We got the premium package and the ride isn't very bumpy
295	1955	We also haven't found the steering to be vague as mentioned in some reviews.
296	1956	I bought the 09 Frontier back in August of 08 and since then I have put 23,000 miles on it so far
296	1957	It gets really good gas mileage for it's engine size I average about 18 or 19 basicly I fill up when it gets to 1/4 tank and I have driven about 325 miles
296	1958	It's really smooth on the highway and offroad the handling is second to none
296	1959	The hill descent feature and hill start assist are really great options to have esp in the winter with snowy conditions
296	1960	Overall just a great truck that can fit four people comfortably on long trips.
297	1961	This has become a love hate relationship
297	1962	My wife and I are car lovers, we have a LARGER number ranging from the smart to several high performance sport cars
297	1963	We live in a semi-rural area
297	1964	Size doesn't matter
297	1965	But I do like the nimbleness of our smart and ease of driving
297	1966	The quirks of the car can get to you
297	1967	Forget the gearbox, much has been written, but how about the rear hatch
297	1968	What kind of a computer does it have that it take 10 seconds to release
297	1969	Why is there no beep confirmation when locking and unlocking doors
297	1970	Maintenance! I am a little of a do it yourselfer....go check the water in the battery
297	1971	It's a joke
297	1972	Many in dealer stock
297	1973	Bloom is off
298	1974	This is my second xterra, my first was a 2000 SE purchased in 99'
298	1975	There is no other suv out at the moment that I would rather have (excluding the larger BMW X's and infinity QX56)
298	1976	My 2000 only gave me a fuel pump problem (replaced by dealer on a recall) in 100,000 of driving, with very bad maintenance record after the 2nd year, changed oil every other year
298	1977	So I figured I pushed it to the max (last day came back from the jersey shore at avg.80MPH and it was time to get a new one
298	1978	I love my 2009 off road - the sound system is awsome
298	1979	The truck, well I'll just let it speak for itself
298	1980	now if I can just pay this sucker off I would be the happiest man on the planet.
299	1981	A nice, solid car
299	1982	Enough power to hold it's own against the big guys
299	1983	The leather sport seats are very comfortable -- I did an 8 hour trip a couple of weeks ago, and could have easily done another couple of hours that day
299	1984	Average mileage has been 38 city / 43 highway
299	1985	I had the same windshield washer issue that JMS mentioned
299	1986	However I found that the nozzles are adjustable and was able to redirect the spray back to the windshield (as opposed to the roof of the car!)
300	1987	I tried to convince myself to buy a German SUV
300	1988	I test drove the X5 (3.0), Audi Q7, and the ML 350
300	1989	In my opinion none of the German cars come close to touching the MDX in handling, comfort and space
300	1990	Material could be a touch better in the MDX (the black fiberglass trim looks cheap for example)
300	1991	But there is no way I could justify 8-10K more for any of the German cars
300	1992	And don't get me started on the RX350 or the CX9
301	1993	After purchasing a 2009 Honda ex-l pilot I realize that the pre-wiring connection was a dummy connection
301	1994	I am not able to connect a trailer wiring harness unless I purchase the expensive kit from Honda
301	1995	The kit cost more than if I had bought the tow hitch separate and had it wired
301	1996	I also found out splicing into the wiring voids the warranty
301	1997	Then I learned that remote start is a problem
301	1998	Turning the car off after remote start just to enter the car is the dumbest idea I ever heard
301	1999	It is my understanding both of these feature was pre-figure to get you to come back to Honda
301	2000	I just wonder what else have Honda done to steer you back to them
301	2001	My first Honda and my last
301	2002	Bad mistake of Honda.
302	2003	Lease was up on my 2005 Highlander V6 Limited which I enjoyed
302	2004	Did a lot of homework on smaller SUVs since we are empty nesters now and always said I'd never go back to a car
302	2005	Test drove many SUVs then I test drove the Camry for the heck of it and I was sold
302	2006	Fits me like a glove
302	2007	Can't believe the smoothness and quiet cabin which is my #1 priority
302	2008	Had 2 Honda Accords years ago and thought they were the best cars I ever owned but I was wrong, this Camry surpasses any vehicle I've had
302	2009	Didn't take any adjusting from driving an SUV to a car which I thought I'd feel
302	2010	Gas mileage is excellent compared to the Highlander
302	2011	City 24.6
302	2012	Highway not sure yet
302	2013	Loving every aspect of this car!
303	2014	Pros: Body style is distinctive
303	2015	Standard DSC
303	2016	Roomy
303	2017	Quiet at highway speed
303	2018	Uncluttered dash controls
303	2019	Huge trunk
303	2020	Nice firm suspension
303	2021	You don't blend into the sea of Camcords in a parking lot
303	2022	Good combination of fuel efficiency, size, handling, and looks
303	2023	Base stereo far better than our Civic EX-L
303	2024	Cons: Front seats shaped weirdly, not the best comfort
303	2025	Steering wheel obscures top of gauges when adjusted properly
303	2026	Stupid red gauge lighting reminds me of wife's old junky pontiac grand-am
303	2027	Auto trans shifts in and out of overdrive too often
303	2028	Clear shifter surround panel scratches easily
303	2029	Little support from online forums, not nearly as much as VW or Honda message boards.
304	2030	Great car
304	2031	I have only had it 3 weeks but I am impressed (good)
304	2032	My other vehicle is F-150 V-8, but this little 4 banger (4 cyl) really has the power, I can't imagine a V-6 in this thing
304	2033	It only has about 870 miles so far but it really goes fast, I have to watch my speed to keep it under 70 mph
304	2034	We took the car over to the coast to break in the engine
304	2035	Up hill and down around sharp curves it was great, power was right there better than my F-150 V-8
304	2036	Gas mileage is outstanding..
304	2037	on our road trip to the coast and back, freeways at 70-80..
304	2038	my average is 28.1 mpg
304	2039	I could not believe it
304	2040	The only bad thing is the brakes
304	2041	You really have to push the brake pedal hard when coming to a stop sign
305	2042	Compared to Camry, Accord, Fusion, and Mazda6 before purchase
305	2043	Loved the features and styling by comparison
305	2044	Beautiful car, great looking/functional interior, lots of car for the money
305	2045	City mileage not as good as hoped, not the best visibility out because of high belt line and rear shelf, and transmission a little sluggish at times around town
305	2046	Otherwise very happy with purchase after 4 months.
306	2047	I think the positives of this vehicle have been covered pretty thoroughly to this point
306	2048	For me, it was this or a CRV, and the deal I received from VW just crushed what Honda was willing to do
306	2049	Sticker on my SE was 29,115
306	2050	Final purchase price was 25,604
306	2051	Both of the preceding figures are pretax
306	2052	I put $2000 down and financed the remainder @ 0% for 60 months
306	2053	Honda thought I was making stuff up, $3600 off MSRP plus 0% for 5 years
306	2054	VW is definitely trying to move inventory, I guess Honda isn't desperate enough yet
306	2055	I absolutely love the vehicle though, but I've only had it for a week so reliability is tough to judge at this point
306	2056	Absolutely zero buyer's remorse to this point.
307	2057	2009 ES in red and black interior - 2wd My wife loves this SUV
307	2058	Did not need extra stuff like 4wd or navigation or high end radio
307	2059	Handles great, good mpg, looks nice
307	2060	Rides very smooth on highway
307	2061	Radio works well, plenty space for five or six
307	2062	Tailgate is nice feature for loading and unloading
307	2063	Car feels and looks more expensive than is was
307	2064	Interior looks sharp
307	2065	10 year warranty.
308	2066	Got my 3.8 on 5/22 - and just returned from a 1,800 mile trip to S.C
308	2067	Despite getting into some horrendous traffic jams - the car still delivered over 25 mpg! Ride is quite smooth - but not perfect - especially on rough roads
308	2068	Beautiful and comfortable interior
308	2069	Whisper-quiet engine with lots of power
308	2070	(Can't understand why anyone would want the 8 cly.) I did not order the tech package, but bought a Garmin instead
308	2071	Unless you need frequent directions - this is the way to go
308	2072	My bluetooth cannot read my voice commands! Will make an appointment with dealer to fix.
309	2073	Luckily, my 12mpg Infiniti QX56 has been traded and this 2009 Acura TSX is the replacement! I just wish I bought one of these before
309	2074	"Great handling! Smooth and quiet! Exceptional automobile! A good size trunk will work for weekend getaways with my wife and 2 girls! The design is ""slick and sassy""! I've owned a '95 Lexus ES300 and a 2002 Volvo S80"
309	2075	The Acura TSX beats both, in every way, by a mile!
310	2076	Could not be more happier buying this car
310	2077	Its very sturdy and holds very well on freeway about 70-80mph
310	2078	Drives very well within city too
310	2079	get about 28mpg within city and 30-32 mpg on highway (mostly because of no cruise control)
310	2080	Excellent second car to have
310	2081	Very spacious too, can easily fit 4 people.
311	2082	I traded my 08 E350 Sport for a 2009 E350 sport mainly to upgrade to the new, faster electronics and music
311	2083	I found no major driving differences, however the HD radio, the NAV system, the Voice Command and the increased response speed for all technology functions is amazing
311	2084	There is almost nothing you can't do with the voice command system
311	2085	It even has a training module to improve the voice command's understanding of your input language
311	2086	Smooth ride and handling are accomplished with the sport suspension
311	2087	Since I had no problems with my 08, the 09 is just icing on the cake.
312	2088	"2009 F150 4x4 FX4 SC 5.4, with 3.73 rear locker, 145"" WB"
312	2089	I traded in my 05 F150 with only 20K miles for this truck, I didn't need a new truck because there was nothing wrong with my old truck,,,,,,, but I was so impressed with the quiet ride I bought it.
313	2090	Switching over from a Chevy Equinox, this car has been amazing
313	2091	I have no real complaints about the car
313	2092	It has 9,000 miles and has only been back to the dealer to have a sunroof put in and for oil changes
313	2093	I do see other peoples concerns with the awkward shifting, but it isn't anything that really bothers me personally
313	2094	The fuel economy says 24, but if you don't drive hard, I easily have cleared 27-28 in the city
313	2095	Great crossover for the reasonable price.
314	2096	Upgraded from a 2003 Focus station wagon with leather and moon roof ? I was looking for something practical, competent and reliable
314	2097	Found it in the spacious Forester
314	2098	Just would have wished road feel less SUV
314	2099	Nevertheless, the Forester beats its competitors? handling and demeanor
314	2100	So far drove 900 miles in city and on a trip to Texas Hill Country
314	2101	3 adults plus driver very pleased with comfort during 5 hours road trip
314	2102	Noise level remains low under 80 mph
314	2103	AWD shines on wet roads
314	2104	AC is more than sufficient for Texan heat
314	2105	Lots of goodies for colder climates
314	2106	Positively surprised by fuel consumption (comparable to old Focus)
315	2107	I have been pleasantly surprised at the fuel economy and pep
315	2108	I drive primarily country roads and I am averaging 28.7 mpg
315	2109	I was apprehensive about buying a four cyl., but the six speed trans really gives it great performance; it feels very peppy and is really fun to drive
315	2110	Unbelievably quiet ride for a car in this price range.
316	2111	I have 4,000 Kms on my new Hyundai and the wheel wells have cracked and are broken in the front driver's side and in the rear - both sides! Hyundai Canada will not consider this a warranty issue and will not honor repairing the car
316	2112	The car was driven on gravel roads at temps or - 35 degrees
316	2113	If the car should not be driven on gravel roads, that means the car cannot drive on 77% of the roads in Alberta!!!!! If this is what I have in two months driving how is the car going to look in two years? JD Powers are completely wrong with this vehicle
316	2114	Will never buy another Hyundai
317	2115	I had initial doubts about it
317	2116	But, seeing is different than driving - it is quite roomy from inside, performs very well in city and high way
317	2117	I love this rounded cube!
318	2118	This is a good car and there are good cash back recession incentives
318	2119	But here is why I think consumer reports lists owners to be less than satisfied
318	2120	When switching vent from defrost to vent or floor, the A/C automatically activates
318	2121	This cannot be deprogramed to function like a normal car
318	2122	Routinely end up driving with A/C on in the winter
318	2123	I'll adapt, but it's frustrating
318	2124	Back seat seat belt connector very rigid, difficult for kids to buckle w/ booster seat
318	2125	Not great maneuverability in parking lots
318	2126	Fuel mileage in city is much less than estimated - highway is good.
319	2127	I totaled out my 07 Mazda CX-7 and fell in love with the 2009 6 after test driving one
319	2128	I purchased an i touring and have no regrets with the 4 cyl
319	2129	The styling of this car is amazing
319	2130	The car has been mistaken for a Lexus three times
319	2131	This is the best car I have ever driven
319	2132	There is tons of room for the family and you never feel like you sacrificed style or performance
319	2133	If you are looking for a great performing, look at me style vehicle for a great price, this is the car for you
319	2134	Great job Mazda!!!
320	2135	My first real car was '77 Rabbit
320	2136	Drove Japanese and American afterwards
320	2137	Realized I missed my VW
320	2138	I absolutely love this new Jetta! Great torque through entire power band
320	2139	Love the tight German suspension engineering
320	2140	Manual transmission shifts like 'buttah'
320	2141	It's so much fun to throw the car into any curve, have it stay planted on the asphalt like it's on rails, give it some throttle and come rocketing out the other side
320	2142	WOW!! And this is the base S model
320	2143	Interior fit and finish is xlnt
320	2144	I'm 6'4'' and have plenty of leg/head room, compared to most Japanese cars
320	2145	There's enough bolster in the cloth seats for those curves, but still very comfortable for my daily commute to the city.
321	2146	No reservation with the 09 Scion I am delighted with the buy, would of love a 5 speed shift but its my work car and the reason for purchasing the car was for economic reason
321	2147	The Scion has proven after three weeks of ownership a bit of a good move on my part
321	2148	Economy is great, roomy, and fun to drive
321	2149	The 2.4 engine make the Scion get and go, economy of the car is really see at the low speeds, the automatic trans could use an additional gear, keeping the RPMs around 1.8k when on the highway and would make the Scion that much more economic for highway use, but with a tight engine I got 315 miles on the first out of town trip
321	2150	Please do not misunderstand the Scion is good on gasoline
322	2151	I've had my Corolla for two months now, it did 25.8 mpg city with a heavy gas hitter
322	2152	The trunk has room for all my golf clubs and the split seat works well for my fishing rods
322	2153	The placement of everything is logical accept the clock
322	2154	The center console is a bit small along with the little compartment with the outlet
322	2155	The plastic does scratch easily leaving marks
322	2156	Everything feels solid nothing loose and feeling like it would break
322	2157	The seating position can fit all, I'm 5'11 with long legs and it's really comfortable
322	2158	If your looking for an economy car that gives you the most bang for the buck, this is it
322	2159	A very big improvement from last year's model.
323	2160	Went to the dealership looking for a Highlander (same size as a Highlander)
323	2161	When we drove the Venza fell in love with it! We were impressed by the smooth drive of the car and the pick up on acceleration
323	2162	My husband loved it at first sight
323	2163	Love the comfort and room
324	2164	This car is the best...I love it!! Sporty looks, nice colors to choose from, love the keyless entry/start, storage, cup holders, auto windows up/down & more, the 4 cyl has plenty of pep and I feel like I have a little bit of a luxury vehicle but at a great price! I compared to Honda Accord but it was kind of boring...I just kept thinkin about the Altima and I'm so happy I went with my gut feeling and chose this over the Honda
324	2165	I have a child so needed a sedan for practical reasons, but I still wanted something a lil sporty too and this is it..the two pipes out the back add to the fun look and I got the rear spoiler which is nice
324	2166	Only wish I could get the fog lights.
325	2167	Fantastic car
325	2168	Extremely powerful and handles very well
325	2169	I didn't like where some of the controls were, like the cruise control and the window/locks being on the center console
325	2170	I expected a bit better out of the sounds system, my G6 in my opinion had a much better sound and much deeper, more powerful bass.
