141	945	Was close to getting a Civic EX coupe but am so relieved I followed my heart (instead of pocket- book) to settle for this Si coupe
141	946	For three grand more, I know I got a car that stirs excitement and delivers both reliability and fun
142	947	My Suburban died and I needed a car so I saw the Flex and loved it but bought an Explorer
142	948	Gave the Explorer to my teens and got myself the Flex! I love the car
142	949	"I was not ready to give up the space of a Suburban so the Flex fits that need but I feel like I am driving a luxury sedan! The extra features of the LTD make it a great transistion car from the mom carpool to the adults have fun car! It handles island driving around all the curves and pot holes just great! A 6""3"" friend of my son told him it was the most comfortable back seat he had ever been in! My teenage son loves the sound system and sits in the driveway playing around with the bass and tremble! The Flex is MY car!"
143	950	After only 3 weeks and 300 km of winter grid road travel, all 4 wheelwells and all 4 mudguards are damaged
143	951	"1 mudguard has a 4"" diameter hole clear through it"
143	952	"I am fortunate enough that my dealer is replacing all 4+4 free of charge in addition to coating them with a rubber compound calling it a ""Goodwill"" repair"
143	953	My maximum grid road speed was always less than 100 km/hr
143	954	The odd thing is, there is basically NO gravel left on the road since it's not graded in the winter..
143	955	currently the maximum particle size is only ~5mm.
144	956	My husband and I researched and drove every vehicle in this class
144	957	In our opinion, the Tiguan is simply the better vehicle all the way around
144	958	Build quality, styling, design, interior layout, handling, braking and acceleration (the turbo was smooth and peppy) are all excellent
145	959	I was originally reluctant to purchase a MB due to what I had heard regarding quality issues in the past
145	960	I must say that so far this car has been perfect, no issues whatsoever, great build quality with no rattles or squeaks
145	961	I did have to replace the OEM tires after 4200 miles due to wear, but other then that the car has performed better then I expected
145	962	The car is FAST but also drives well on the highway for normal cruising
145	963	The electronic package is top notch as well
145	964	The HK stereo is great sounding, the navigation is clear to understand, and the voice recognition is far better then what my Acura has
145	965	Overall I would buy this car again with no hesitation.
146	966	Just bought this vehicle after extensive research, including BMW 335i, 535i, Infiniti M35/45, among others
146	967	This vehicle was the best value from a features & performance per dollar standpoint
146	968	The BMW's had a slight edge on drive experience and handling, but not enough to warrant the higher price and sacrifice on all other features
146	969	The technology inside the CTS is incredible, with only a few annoying exceptions (see below)
146	970	I am very happy with this car and look forward to driving it every day
146	971	It has great curb appeal and is a vehicle that makes you feel great when driving it
146	972	If you like music, then you'll esp love it
146	973	Between the ipod interface, 40G hard drive, and XM, you can't ever run out.
147	974	Was told by dealer the a/c cycles cold to warm so it won't freeze up! I have owned a lot of cars domestic and import and I never had this problem before
147	975	Where I live the summer temps run 95-110 June to October
147	976	Because of this I would not recommend or buy another Subaru.
148	977	This car has been a pleasure to own and drive
148	978	I have a long commute every day and this vehicle very comfortable-- smooth ride, spacious, comfy seats, low cabin noise
148	979	This car has TONS of trunk/storage room, way more than I expected and also has lots of head room
148	980	It does great with gas mileage and has plenty of pick-up on the highway
148	981	The SL is definitely worth the extra money
148	982	It has a much nicer interior and a center console (S does not).
149	983	One of the roomiest cars I have owned in a long time
149	984	I am as comfortable in this car as I am in my Silverado Pick-up
149	985	I am over 6' tall and it is one of the few cars I have been in that I can't reach the pedals with the seat all the way back
149	986	Dealership was great
149	987	For the price, warranty and dealer support you cannot beat it.
150	988	I've had my red Malibu LTZ V6 almost 2 weeks and I absolutely love it
150	989	"It looks like a million bucks - everywhere I go people ask me, ""What kind of car is that? It's so pretty!"" It drives like a 4 door sports car and handles like a dream"
150	990	So far it is getting 30-31 mpg on the hwy and 18-22 in the city
150	991	It seems to get a higher avg mpg as I get a few more miles on it
150	992	The OnStar nav is great as I have no sense of direction
150	993	The seats are beautiful and comfortable and the trunk is roomy enough for a trip for 4 for a few days in N.O
150	994	The elec plug in the back is awesome
150	995	Everyday I find more to love about this car! I feel like a celebrity when I drive it because everybody stares at it
151	996	Rides like a sedan and accelerates quickly but the engine screams trying
151	997	"Fit and finish is good as well as good legroom/headroom for a 6'4"" guy"
151	998	I expected better mileage than 22 MPG since my previous Sequoia, with a V8, got 20.5 MPG
151	999	The sticker stated 24 MPG on the highway and it doesn't come close.
152	1000	I have been driving my Ford Edge Limited since March 09, and all I have to say so far is that I Love It!! The main reason why I picked it over the other vehicles I was considering was the technology package
152	1001	You get so much more for the money compared to other vehicles
152	1002	The exterior designed is powerful and I love the way it drives! 
153	1003	Compared this car with other models and brands
153	1004	Clearly ahead of the competition
153	1005	Styling, interior room, sporty handling and more than enough power
153	1006	Fuel economy as advertised
153	1007	Loaded with technology
153	1008	Was about to purchase an X5
153	1009	After driving the Q5 and comparing space, feel and price, the Q won hands down
153	1010	Great car!
154	1011	I just turned in a 2006 FX
154	1012	I loved that car because it had versatility and handled like a sports sedan
154	1013	When I went back to the Infiniti dealership to check out an '09 FX, the new version just didn't whet my appetite
154	1014	Too exotic maybe
154	1015	I test drove a G37X and wow! Now that's a sports sedan! I gave up some storage and SUV driving height, but came away with a rocket ship on wheels, that is as tight as a drum
154	1016	I had test driven a BMW 328X also and this car is as tight as that but with ample more power
154	1017	The 328 is not even in the same class power wise.
155	1018	Since buying this car in July, it has been in the shop 3 times for a thunk in the front end--which they are replacing parts, but it's still there and now I am dealing with an odor in the car that smells like BO (body odor)
155	1019	There are issues with this car and right now I am not a happy Hyundai owner
155	1020	I would hold off buying a 2009 until they figure out some issues with the car
155	1021	This is a brand new car, should not be in the shop already.
156	1022	This car is incredible! Drive experience so comfortable you don't really care about getting to your destination! The real surprise- my fuel economy has been a solid 21.5 mpg driving 90% city 10% highway
156	1023	This car hauls large items well
156	1024	I put an 8ft potted tree in the back in front of several skeptical on-lookers
156	1025	I have had not one problem with this car and it was delivered with 0 defects
156	1026	Warning: if you drive one, you'll want one!
157	1027	This is my very first car and I know I made a great choice
157	1028	It takes less than $25 to fill up my tank and I am good for the rest of the week
157	1029	The interior is comfortable and I get compliments on the exterior
157	1030	For a first car or something that in inexpensive and good to drive get this car
157	1031	It is also roomy for my family of four.
158	1032	 Excellent exterior and interior styling; interior is understated and straightforward with intuitive controls
158	1033	Trunk and backseat are both surprisingly roomy (best in class) for a retractable hardtop
158	1034	Roof function is smooth and quick
158	1035	Low-end torque is a little weak, but the turbo makes for a zippy little passer once it is underway
158	1036	Fuel economy is great
158	1037	This car is a well- kept secret, making it pretty unique
159	1038	I just bought this turned in my 07 and wow what a difference for only 2 years
159	1039	You can notice a little more pickup, the 07 525 was a real dog
159	1040	The handling and suspension, what can you say it's a BMW, I told myself I'd buy a Genesis or try something new, but for an enthusiast driver, THERE IS NO COMPARISON TO THE FEEL OF A BMW this car is soo tight.
160	1041	I've owned many M-B's since 1984
160	1042	This is a very nice car, but after a month, I wish I'd gotten the C350
160	1043	I also have an '06 Porsche Carerra S Cab and just turned in an '07 E350
160	1044	It has P1,P2,Nav,18's and Panoramic Roof
160	1045	All that stuff works great, but the seats are not as comfortable as my E350 was
160	1046	My two major gripes are the brakes and power
160	1047	I do 70% freeway driving and at 65 mph, this motor has limited passing ability
160	1048	Punch it and it makes a lot of noise, but takes an hour to get around a big rig, especially on an uphill grade
160	1049	I guess it depends on what you're used to
160	1050	Additionally, the car is 'underbraked'
160	1051	You really feel the brakes straining to bring the car down when needed.
161	1052	Loved this car so much
161	1053	Outstanding fuel economy: Mix driving 42 mpg (with fastest speed up to 75mph and slowest is 40mph)- City driving is from 35 to 37 mpg
161	1054	My new Fit has less than 300 miles on it
161	1055	Too sure it will get up to between 47 and 50 mpg (mix driving) easily when engine breaks in
161	1056	Great visibility
161	1057	Looks great both in and out
161	1058	Beautiful interior
161	1059	Spacious
161	1060	Magic seats
161	1061	Great handling
161	1062	Fun to drive
161	1063	Exceeded EPA rating (27/33/30)---> NEW EPA RATING SHOULD BE: 35/45/42
162	1064	I purchased my 2nd Murano in November of '08
162	1065	Traded my '03 Muranowith 95,000 miles
162	1066	I am not disappointed with new vehicle
162	1067	Many improvements over previous model
162	1068	Navagation system awesome, radio great with recording feature
162	1069	Ride very good but noisy with moon roof open
162	1070	"I miss the memory seat that Nissan decided to remove from the ""09--had it in the '03"
162	1071	Don't understand that decision? Overall, very satisfied, would highly recommend
162	1072	I can fit 4 sets of golf clubs across the back of trunk
162	1073	Try that in any other SUV out there, including Lexus RX, Lincoln MKX, Ford Edge--no way! I tried it already
162	1074	Doesn't sound like a deal breaker, unless you are a golfer!
163	1075	The dealer was wonderful
163	1076	Got a very good price for the vehicle
163	1077	The vehicle it self is excellent for me, a single male living on my own
163	1078	It gets around town very well, the freeway drive is comfortable
163	1079	The audio sounds good, and AC cools well
163	1080	The steering wheel is a little touchy, but that could be me who use to own a 96 Mercury
163	1081	The brakes are great, and the layout of the interior is excellent
163	1082	Overall this vehicle was the best value out there..
163	1083	Hyundai has awesome rebates, check your local dealer
163	1084	Going one on one with Honda, this car offers the same as a honda that cost 1500-2000 more
164	1085	This is a SLT Quad cab With the 5.7 Hemi
164	1086	I have to say, this truck was long overdue
164	1087	After test driving all of the 2009 competitors, this monster handles all of them in just about every catagory
164	1088	Where else can you get 390HP w/407FTlb torque and still get 14 City & 20 Hwy? The rear coil-overs make rear leaf springs a thing of the past
164	1089	I pull a 3000 lb boat&trailer, and have never used the Tow/haul feature
164	1090	Build quality this year is drastically improved inside and out
164	1091	This was the last truck I had in mind when I started shopping, but its in my driveway today.(with no regrets so far)
165	1092	This is a great car
165	1093	I researched MBZ first, having driven 240Ds for 20 years
165	1094	This car is powerful, handy, and responsive
165	1095	Mercedes lost out with half the fuel economy and much higher prices for diesel models
166	1096	Spent a lot of time researching TSX's over several months
166	1097	Driving the 2nd gen compared to the 1st gen was night and day
166	1098	This is arguably the best car on the market under $30k for what the car offers as standard features
166	1099	Bought mine 12/31/08, am 5,000 miles in, and still have a smile on my face every time that I drive it
166	1100	GREAT vehicle for Road trips
166	1101	Overall, a very economical car
166	1102	For a smoother ride, I recommend not putting on aftermarket low-profile tires/rims.
167	1103	I've had this truck for about 4 months and I'm very satisfied with my purchase
167	1104	I was a little concerned that the engine might be a bit wimpy but I find it can hold its own in traffic with no problems
167	1105	Everything seems to be working well
167	1106	No unexpected wind noise or squeaks, and my radio works great.
168	1107	I've been driving my TSX for a month now and I like it a lot except for the ride quality
168	1108	The suspension is way too stiff and the ride is jittery on any surface (as noted in Consumer Report)
168	1109	I'm told that it will soften with time
168	1110	I hope so
168	1111	The 5.1 sound system is outstanding
168	1112	I don't have a problem with the nav screen because I'm short but I can see that if I was several inches higher in the seat, I would see the reflection of the windows in the nav screen
168	1113	Not good
168	1114	Excellent build quality overall and no problem whatsoever so far
168	1115	I'll report again later in the year.
169	1116	We bought this car for my wife to run around town and back and forth to work
169	1117	We traded in a 2000 Nissan Xterra and my wife is very happy with it so am I! We average 30 mpg city and 40-42 Hwy (safe range is about 400 miles on the Hwy) The 1.8 auto has plenty of get up and go and the transmission is fantastic
169	1118	Ride and handling is good, electric steering requires correct driving form on the hwy (both hands on the wheel) around town its great for parking
169	1119	We recently took it on a 1200 mile road trip loaded up with 2 adults and young child very comfortable although the door armrests are annoyingly low
169	1120	We have always owned Toyota or Nissan, our old 93 Tercel had over 200,000 miles when sold.
170	1121	I may have had the first 09 335i in all of CA while the rest were stuck in customs at the Long Beach Port in LA
170	1122	This car is great! Fast, tight, great control, nice new body look with minor changes in the 09 in the exterior as well as on the interior
170	1123	iDrive is so much better then old system
170	1124	Great maps, options, usability, hard drive! And with the new twin Turbo which does its part to conserve gas this beast has power when you need it, and style when you are just rolling
170	1125	Perfect mix of luxury and sport
170	1126	The back seat is too small, but I guess thats why there is a 5 series.
171	1127	This is my second 427 Corvette, the first being a 1966 and needless to say the difference between night and day
171	1128	I like most every experience I have had with the car, from the dealer on down
171	1129	This car was meant to be driven every day if need be
171	1130	One has to remember this is a sports car and not a Cadillac and so it rides like a sports car, no problem there
171	1131	There are so many after market things that can be done to this car and the service manuals make it easy on the DIY?rs
171	1132	Out there on the road there are not too many cars that can hang with you regardless of price
171	1133	It's a gentleman in town and a warrior on the road
171	1134	Love the Cyber Grey
172	1135	We were on our way to test drive a new Camry
172	1136	Took a swing into the Mazda dealer because I knew the design had changed and wanted to check it out
172	1137	After a test drive we kept our appointment w/ the Toyota dealer
172	1138	This Mazda has it all over the Camry, I couldn't even get alloy wheels on the LE model (which really pi**ed me off)
172	1139	Short story, we went back to Mazda and got a good deal on a car (so far, 2 mos) that I think is nicer than the Camry (which is a very nice car).
173	1140	We purchased the car at the end of March
173	1141	Most of our driving is in the Minneapolis metro area
173	1142	No trips over 100 miles one way
173	1143	We like the car a lot and are happy with the purchase
173	1144	It's an enjoyable car to drive if you like quiet and good handling
173	1145	We're averaging 38-40 mpg per tank
173	1146	We too have had the Check Engine light issue concerning the gas cap
173	1147	(4 times in 7400 miles.) This past Wednesday night our dealership told us that Toyota will be coming out soon with a Tech Service Bulletin
173	1148	The gas tank neck is faulty and has to be replaced
173	1149	Ours is scheduled for next week
173	1150	Supposedly with a new, improved one.
174	1151	Traded in my 2000 A6 2.7T on the CC
174	1152	I am very pleased with the of the car overall
174	1153	While not as luxurious or powerful as my old Audi, it's hard to believe this car can be had for under 26k
174	1154	It looks and feels like a much more expensive car and the 2 tone leatherette interior is top notch
174	1155	The clutch is very light and the 6 speed manual is satisfying
174	1156	This is a great car! I hope it proves to be reliable long term vehicle
174	1157	That was my only concern repurchasing from this German brand
175	1158	What is not to like about a quality 4x4 6 cylinder SUV for $16K
175	1159	Electric windows, power locks, cd player, excellent in the snow
175	1160	Only one problem was the right side power mirror stopped working
175	1161	Will wait for a month and see if any other little things pop up
175	1162	The best deal is a 10 year / 100,000 mile warranty
175	1163	Come on now see if you can come close to Toyota and Honda with this kind of deal
175	1164	I researched this hard before I bought and I am please as punch to get this great car
175	1165	Time will tell how it stand up but so far so good.
176	1166	Got this towards the very end of the clunker deal
176	1167	I settled on getting the Touring after looking at a variety of hatchbacks, from a Nissan Versa at the low-end to a Subaru Impreza at the high end
176	1168	Unfortunately for me, these things are extremely popular and after looking for one for nearly 2 weeks, I got the color I wanted (Vivid Blue) but I didn't get the premium package I wanted in time(sun roof, etc.) Immediately noticed is the quality of the interior and how pleasing it is to look at
176	1169	I'd say only the Mazda3speed is more sporty looking
176	1170	Got the Automatic & drives like a breeze
176	1171	Not real sporty but way more so than my old Pathfinder
176	1172	All in all, a great car! Highly recommend it! 
177	1173	Premium Plus w/nav in Ibis White I had never really considered an Audi until I drove the Q5
177	1174	It clearly is a well-thought out vehicle and very much fun to drive
177	1175	Regular Drive mode leaves a little to be desired in first and second but Sport mode (and Triptronic) is where the fun is...0-60 in FAST! MMI is solid, cargo space may not be as large as some others but that was not a factor for me (don't have 22 kids and 3 dogs to shuttle around), gas mileage seems to be above listed, visibility is very good, steering responsive but not overly sensitive, braking is predictable, road noise is low even on 19s, and the most important factor is that it feels like a sedan and drives like one.
178	1176	What can you say except wow
178	1177	Just a sweet looking car that is super fun to drive
178	1178	We receive compliments everywhere we travel, from the tires and rims to the well appointed interior space
179	1179	I was originally looking at Honda CRV and Toyota Rav4, but was concerned about their blind spots and bad rear visibility for backing up
179	1180	So I looked at the Subaru (with AMAZING visibility in ALL directions) and sold on the appearance, performance and features
179	1181	The Subaru Symetrical AWD is also superior to the 4WD technology on Honda and Toyota
179	1182	Regarding other reviews: The base trim does not have cup holders in the back seat center console, but ALL trims have cup holders embedded in the back doors (perhaps the other reviewers haven't noticed?)
179	1183	The radio seems just fine to me
179	1184	The passenger seat is low, but not a showstopper
179	1185	The driver seat is very comfortable in the Limited trim.
180	1186	This truck has had transmission issues since the day I bought it
180	1187	Toyota refuses to admit it is a problem, even though it is well documented on the internet
180	1188	Transmission continually slips when accelerating after a turn or even going over a speed bump
180	1189	There is a clunking/jumping effect around 30mph when letting off gas then getting back on the gas
180	1190	Also have had an annoying buzzing sound from under my glove compartment and a rattling window control panel
180	1191	Body dents very easily
180	1192	Very worried that transmission will fail before my 36k warranty.
181	1193	Beautiful car! The only complaint I have is I wish it had more horsepower
181	1194	I have a G35 coupe which has 280HP, and going down to 228HP is a little change
181	1195	The ride is awesome
182	1196	Great car overall, but the clutch pedal is a bit too heavy for regular city stop and go driving
182	1197	I live in Philly and all Infiniti dealers are located in the suburbs
182	1198	The suburban test drive and the back roads that showed off the handling really didn't reveal how tiring the clutch pedal would become in the city environment where I reside
182	1199	I have a 2006 Honda Element with manual trans that is a pleasure to drive in the city with its light clutch and precise shift action
182	1200	It's very, very similar to the BMW 3 Series that I recently test drove
182	1201	If I could have driven the Infiniti in the city for a day or two I probably would not have purchased it despite its other wonderful virtues.
183	1202	"Some ""professional"" reviews talk about the 5 speed trans being ""jerky."" At 13 miles on the clock, it was"
183	1203	By 200 miles, it had smoothed out considerably
183	1204	It could be a mechanical form of tromp loi, but everything sounds solid about the Aveo
183	1205	The handling is sensitive but precise enough for me
183	1206	Mileage has been as advertised
183	1207	Everyone who has ridden with me comments about the roominess and exelent visibility
183	1208	With the LS you get the basic car and so is reminisent of Pinto, Vega, Colt, Civic of the past (had 'em all) but somehow a little more evolved
183	1209	The option packages seem a little lop- sided
183	1210	Time will tell on reliability, but for now I have no issues and enjoy my new ride every day.
184	1211	I love the car, it is quiet, low road noise
184	1212	But, it burns oil
184	1213	At 600 miles I have had to put in a half quart already
184	1214	Furthermore, you would think for a car that burns so much oil, it would come with a dipstick, but, it does not
184	1215	I wish I would have researched problems like this before buying
184	1216	I do regret my decision now, oh, and for Audi, the current oil consumption is within their limits so, I drive with oil in my trunk at all times.
185	1217	I just bought a hatchback Yaris because it was a Toyota and I wanted a small car w/good mileage
185	1218	I previously owned a VW beetle which I loved but it was getting too costly to own - so I went w/a Toyota mainly because of the reliability of the company
185	1219	I owned Toyotas in the past and a Honda - I would've bought a Honda Fit but it was more expensive than the Yaris
186	1220	Well, it has only been 3 days but this truck is awesome, way better than my 99 taco x-cab 4 banger 4x4
186	1221	Fit and finish are excellent
186	1222	Ride rivals that of my wifes grand Cherokee (car like)
186	1223	Only thing I am having trouble with is you cant hear the engine and it is a manual tranny
186	1224	I have always just shifted on instinct and now I have to use a tach
186	1225	I guess the trade off is the very quiet ride
186	1226	All the standard safety features are nice (6 airbags, trac cont, 4 wheel abs all base model stuff now)
186	1227	I will get the monitor for the tailgate cam, will help with hooking up the trailer
186	1228	This is my 8th Toyota vehicle, and it appears they have hit yet another grand slam.
187	1229	I bought this car earlier this month and absolutely love it
187	1230	I did a LOT of research on 2009 sedans (including Camry, Accord, Jetta, and Altima) before deciding on the Accord
187	1231	The Accord is top-notch As soon as you get in it you feel like you are sitting in a luxury car that should be much more expensive than a Honda
187	1232	And performance is great! I am very pleased with the car...except for 1 thing---the headlights dim just a bit about every 15-20 seconds when the AC is on
