0	0	I've been driving my new Rav for about a month now, and I'll admit I've been surprised (in both good and bad ways) Good (With 4cyl): Incredible gas mileage
0	1	I average ~30mpg interstate (with cruise control going 65mph) If I go up to 72mph, I drop to around 24/25mpg so the trick is to keep it slow
0	2	Additionally I can get a solid 34mpg doing 55mph on more rural travels
0	3	I also use the aux jack constantly with my MP3 player, don't know how I went 9 years without one
0	4	We had aftermarket heated seats installed in the cloth seats, nice in Pennsylvania! Bad: The cloth seats are NOT comfortable, sure, they could be worse (i.e
0	5	Subaru) but it may be worthwhile to go for leather.
1	6	This is my 3rd MDX
1	7	Great vehicle, reliable, comfortable, quick and fun to drive
1	8	Dollar for dollar there is no better SUV on the market today
1	9	I have put about 100,000 miles on the 3 MDX's with few if any problems
1	10	My only real gripe is that the few problems I have had, have been dealt with poorly
1	11	The service departments of the Acura dealers are well below par, in fact they are poor
1	12	This is my 4th Acura in 7 years and as much as I love the vehicles, because of the quality of Acura's service, this will probably be my last
1	13	Honda get your act together you ain't no Lexus.
2	14	I've had my new Outback Sport for a few weeks now and have been very satisfied with it so far
2	15	I'm still getting used to the different (read: better) handling of the AWD
2	16	I test drove roughly similar vehicles (Honda Fit and VW Rabbit) and this Subaru, while more expensive, just felt much more intuitive and well thought-out
2	17	The seat warmers are nice and standard on this trim
2	18	The fuel economy is better than expected (26-27 mpg city+highway), even this early in the car's lifetime.
3	19	Did the NCM (R8C) delivery on 10-23- 08
3	20	After hearing the car rolled off on 9-23-08 I was like a kid waiting for Christmas
3	21	I arrived with my sister and dad
3	22	The delivery experience was super
3	23	NCM guide was awesome
3	24	Drove 3000 miles back to Seattle via Chicago, Denver, Boise, and then Seattle
3	25	I could not be happier
3	26	Over the entire trip I averaged over 28mpg! Road noise was not an issue
3	27	Wish all my cars had a HUD, hands free Bluetooth, XM radio and 505 hp! The hardest part is keeping the smile off my face
3	28	Heard a lot of negative items about the car like road noise, steering, ect.
3	29	Nope, 125% satisfied with my Z06.
4	30	Since purchasing this SUV I've been more than pleased
4	31	It makes driving fun again
4	32	It's roomy but sleek on the inside
4	33	I've found that it has plenty of power for everyday driving and I've averaged 20 MPG so far (both city & HWY)
4	34	After driving domestic cars my whole life I can now see why they are in so much trouble
4	35	The Honda Pilot is best in its class in my opinion.
5	36	Turbo 4 provides plenty acceleration with good gas mileage
5	37	Handling is unreal
5	38	Considered the BMW 328 and Cadillac CTS
5	39	Both were great but did not appear worth the extra cost (insurance, maintenance and purchase price)
6	40	Before I bought it I test drove Infinity G35, M35 and Acura TL
6	41	I even brought Infinity M35 to Hyundai dealership, parked both cars next to each other, opened all doors and trunk and almost compared each inch of the cars
6	42	"I am waking up every morning and thinking: ""I will be driving Genesis today again!"" Incredible car!"
6	43	Some previous reviewers seems like didn't read car manual
6	44	Side mirrors reverse tilt down can be switched OFF, trunk has push button right above license plate (slightly to the right).
7	45	Bought this car last weekend
7	46	I love the power the V6 provides
7	47	The ride is nice and smooth and the SE sport package really adds to the look of the car
7	48	"I got it in black with the 17"" rims and love the way it looks!"
8	49	The body of this car is by far the best looking on the road today
8	50	And Deep Sea Blue is the most beautiful color I?ve seen
8	51	In the shade it looks black, but in the sunlight it?s a gorgeous three dimensional metallic shade of dark blue
8	52	I think the darker colors bring out the lines better than the lighter ones, but I?ve read other reviews that say the opposite
8	53	The conclusion: the car has awesome lines regardless of color
8	54	The MMI isn?t as confusing as some reviews say; however, most actions are a two-step process
8	55	It?s a little more work, but there are SO many options for comfort, information, entertainment, etc
8	56	If you?re considering this car, go drive one, you?ll love it
9	57	I seriously considered (and test-drove) the Toyota Avalon, the Lexus ES330/350 and IS250, and the Maxima was just a better overall vehicle
9	58	It's comfortable, stylish, feature-rich, and extremely fun to drive
9	59	The CVT transmission is very responsive, the engine has ample power, handles like a sports car, yet has room for 4 people (it has seat belts for 5, but the 5th one had better be a midget)
9	60	I fell in love with the iPod integration immediately, and the center console computer (I didn't buy the nav) has bucketloads of information if you desire info
9	61	I can't say enough about how I enjoy the SmartKey (breaking the habit of taking out a key was easier than I thought)
9	62	Terrific vehicle! 
10	63	Traded a BMW 745i for a Toyota Hybrid
10	64	With gas approaching $4 for premium it was time for a change! Tested Prius but could not make the transition with hardly any creature comforts available in this region
10	65	Didn't discover the Camry until the last minute
10	66	Customer reviews here and elsewhere on the web boast how great this car is so I went to take a test drive
10	67	Truly, I thought I would give up a lot to save gas and the environment but instead was quite surprised! Got the hybrid fully loaded and couldn't be happier
10	68	"Every day I ask myself, ""what took me so long!"" Get a Camry Hybrid!!"
11	69	The car is beautifully crafted with subtle elegance
11	70	The AWD worked superbly in snow and ice
11	71	The vehicle is quiet, responsive, and thoughtfully designed, inside and out
11	72	The voice command system is a marvel and requires little more than a quick read through the manual
11	73	Like other buyers, I would have expected leather at this price
11	74	That is the one area where MB falls short.
12	75	Buyer Beware of transmission problems
12	76	"The transmission ""slipped"" on my brand new 2009 Saturn Aura at 347 miles"
12	77	I had to have it towed twice
12	78	The dealership returned it to me and assured me there was nothing wrong, despite the fact that I pulled out in front of traffic and could not accelerate
12	79	"I was told to ""...pull off to the side of the road, shut off the engine, then restart the car to 'reset' it."" After this occurred the third time, I did as instructed, then drove it to the dealership, and left it there"
12	80	I insisted it was dangerous, and I was now following the GA Lemon Law
12	81	They replaced the transmission at approximately 700 miles
12	82	I would rate my experience with Saturn a big 0.
13	83	Update from 12-08,purchased new 9- 08.G8 continues to perform flawlessly,was able to do a home oil & filter change(simple no problem d riving on ramps).19 in tires were wearing more on out side of tires
13	84	had a 4 wheel allignment done underwarranty, hope that works, tires are pricey.Gas mileage has remained pretty constant averaging about 20 mpg in my mixed driving
13	85	Like some other reviews I really hope GM finds a way to save this car(Ihave faith in bob lutz)we have seriously considered a second g8., but at 67 I doubt it.
14	86	This car has been nothing but a headache since a month after we purchased it
14	87	It had an axel seal to bust causing oil to leak on the exhaust, the transmission is always shifting gears, sometimes it wont shift down when going up hills, then when it does shift down it wont shift back up, it down shifts to low gear while in cruise control going 70 mph on the interstate & almost got us hit,Chrysler says that's the way the car is designed to work, power steering whins all the time, Chrysler says that is normal also
14	88	Any problem that this car has Chrysler says it is normal so it doesn't do any good to call them with your problems
14	89	All i can say is LEMON, this car should have been YELLOW.
15	90	Was going to get a Yaris sedan
15	91	My wife just got one and I really liked it, but there nowhere to be found
15	92	Glad I tried this baby
15	93	I traded in My 2001 Mustang that was in great shape, but the winters are getting tough for me to drive and also gas prices so it was a tough thing
15	94	But it took me 2 days of driving this car and I love it, not quite the pickup the mustang had but who cares
15	95	The steering that people are complaining about is touchy but you do get used to it, no biggie to me
15	96	I love the look both inside and out (Black pearl)
15	97	MPG avg is 41 mostly highway but a little mix
16	98	I thought Honda was supposed to be one of the best..
16	99	well what happened? Do they not check out everything before they sell them? 1st time I turned on the A/C I got a horrible smell - then fog (not condensation) of course the service dept didn't believe me when I called, but oh wow, now they do because it is sitting in their shop
16	100	They have no idea what's wrong
17	101	I just purchased the 2.4 2009 vibe with manual trans
17	102	I offered $200 less than the TMV and they accepted my first offer to my surprise
17	103	Great car and if you want to buy one, offer a ridiculously low amount to start with
17	104	They are practically giving these away with all the incentives
17	105	I wanted the 1.8L, but couldn't find one
17	106	The 2.4 is more than enough power, but I still get over 30 MPG with 50/50 driving, so I'm very happy
17	107	Manual is fun to drive and very comfortable
17	108	Cargo space is great, as I can fit my bike in the back without taking any wheels off
17	109	Sound system is great
17	110	I switched from a huge suburban to this and I don't regret it
17	111	Cash for clunkers program is a great deal.
18	112	Got the LS (w/auto) under cash for clunkers
18	113	Outstanding car, especially at the price paid
18	114	Ride, handling, features all excellent
18	115	Lot's of fun to drive, and nearly as versatile as a minivan
18	116	Seems to be very well built
18	117	Base model plus auto and roof rack has everything I need
18	118	I drive in heavy stop and go traffic daily, but have improved my gas mileage by more than a third
18	119	My only complaint- the basic stereo! Has all the features you might want, but sounds like a 1960's pocket transistor radio
18	120	Spring for the upgrade if you can
19	121	I have 2009 that has been in the shop three times under 6000 miles,once for a failure of the tire pressure sensor, twice for IMA battery failures
19	122	The car is currently experiencing the same type of behavior as before the last IMA failures
19	123	Honda states they are having battery problems
19	124	In addition, Honda customer service states the MPG is actually normal for winter driving for Missouri
19	125	Dealer failed to inform us of this when we purchased vehicle
19	126	I find this to be an unethical deceptive practice by Honda
19	127	Car is not the quality we expected from Honda.
20	128	Love the car, hate the wind noise on both the passenger side- whistle and the driver side continual
20	129	Also problems with the windshield wipers
20	130	Have had it to Dealership to resolve the wind noise problem(s) and is still not resolved to my satisfaction
20	131	We like the car I don't like the excessive wind noise
20	132	If I has noticed this in my test drive would not have purchased this vehicle- unfortunate because other than that it seems to be a great car.
21	133	Bought a 2005 AWD Limited and turned 100,000 miles on it
21	134	New car deals are so good now that we traded it in for the 2009, and the new version is so much better! Better looking, smoother driving, and the perks are all very cool
21	135	"Have a hard time understanding how Edmunds calls this SUV ""adequate"" but owners have rated it much closer to the truth"
21	136	Went to FWD and 4 cyl this time and getting 27 mpg on the road
21	137	We have a 6 year old black lab so we get the dark interior and we love the way the rear seats fold flush to the back of the front seats - Max loves to lay with his head on the headrest between us so many other fold-down rear seats just didn't work for us
21	138	The best little SUV made! 
22	139	This is my 3rd maxima and the best
22	140	My first one was a 95 and loved it, second one was a 2000, disappointing
22	141	I walked away from maxima since lost its personality
22	142	After driving other nissans like, 350Z, murano and altima coupe now I'm back to maxima again and could not be happier
22	143	I love everything about this car...well just about everything, accept I wish it was rear wheel drive just like the infiniti G37
22	144	Maybe we'll get there in a few years
23	145	Just got the 2009 Acura TL/AWD/Tech today
23	146	Wow, what a great car this is
23	147	The handling was superb and the drive is fun and comfortable
23	148	I love the Technology Package and especially the voice recognition system
24	149	I test drove 7 autos in this category and nothing came close to the comfort or the ride quality or the PRICE
24	150	We have the Limited V6 with everything but GPS
24	151	I kept reading reviews that the handling was all that great, our other car is a Avalon and I fail to see the difference
24	152	I researched this car for three years while comparing it to others and price/feature wise nothing comes close
24	153	Large trunk and well shaped with fold down rear seats, some have a pass thru.
25	154	1800 miles so far
25	155	Fun to drive
25	156	Feels like a sports car
25	157	Great for utility
25	158	Only slightly smaller in back than my 4runner
25	159	2.4L engine is great but reduces mpg
25	160	I get 30 highway
25	161	35 would be more to my liking
25	162	It's worth it to me so far though
25	163	5-speed manual is fun but needs one more gear on the high end
25	164	A 6th speed (extra overdrive) is what it really needs
25	165	That would gain a few mpg and reduce revs on highway
25	166	This engine could handle it
25	167	Gas pedal seems to be on wrong angle for me (6' and slim)
25	168	Right foot hurts if I drive highway too long
25	169	Always get a nice greeting when people see it, esp younger
25	170	It is a slick looking car
25	171	Clutch was jumpy for first 1000 miles, ok now.
26	172	My F150 has 16,500 miles now
26	173	I can't say enough good words for it
26	174	I just want to say: everyone must have this truck! This truck has a 18-19 combined MPG so far
26	175	It can do everything what a sedan or SUV does
26	176	It seats 6 people
26	177	more room
26	178	more comfortable
26	179	It can do many things a sedan, SUV, mini-van can't do
26	180	You understand what I meant
26	181	I go hunting, fishing
26	182	I help people move their heavy, large stuff
26	183	I buy stuff for my house and garden
26	184	etc
26	185	Everyone must buy a F150
26	186	Only F150!
27	187	I just recently traded my 2002 T&C for a new '09 Touring edition
27	188	I first test drove a used Mercedes E-class because we already own a Mercedes SUV which my husband loves and of course was pleased with the ride but when I asked the question whether our six member family was ready to have my husband's SUV be the largest vehicle in our household, answer came back a resounding NO
27	189	Because have had such great experience with two previous T&C's (trade-in had 130,000+ miles) decided to check out new T&C and dealer incentives
27	190	By the time all the incentives were added (including $3,500 for trade-in) my $37,000 minivan went down to $28,000 and well...the rest is history in the making!
28	191	After my research & comparison on Toyota Yaris & Honda fit, I decided to get Yaris because it wins in most category & fit my needs for daily use
28	192	For two fill-ups, I got 41 MPG ( 40% city/ 60% highway) by driving it gently
28	193	It's amazing & almost as good as a Prius
28	194	The finish is excellent & the dashboard & charcoal fabric are nicer than others
28	195	The ride is smooth & relatively quiet
28	196	It accommodates 4 adults comfortably
28	197	The power & acceleration is outstanding for this small 1.5L engine
28	198	There is nothing to dislike.The only thing I don't like is that the power door lock/keyless entry is not standard
29	199	I just got my Murano a few days ago, the car is extremely great!! Modern looks, luxury interior, great mileage for an SUV
29	200	I compared the Infiniti EX35, FX45, Lexus RX350 and Murano, after all my research, test drives, etc
29	201	I ended up getting the Nissan Murano, sporty look, great tech features, great mileage
29	202	So far totally in love with the car
29	203	Thanks.
30	204	After our third came around it was time to move up in terms of size with our vehicles
30	205	This is our second Honda product so no real surprises in build/material quality, which as been good so far
30	206	The van has been very functional and the power doors are great
30	207	The space within the van is excellent, as is the driving characteristics of the vehicle
30	208	Gas mileage is been in the middle 20's so far, but I will expect less during the winter
30	209	The children love the van and taking long trips has been a much more pleasant experience for the whole family.
31	210	Just picked up the ML for my wife
31	211	We looked at the X5, Q7 and the MDX
31	212	The ML interior is great compared to the others
31	213	The ride is fantastic! I believe that whatever issues this car had previously-they have corrected
31	214	My wife is in heaven
31	215	She loves the seats and says they are the most comfortable she has ever had
31	216	The ride is very quiet and the handling is smooth
31	217	We are very happy with our choice.
32	218	The car rides great, pretty stiff suspension that handles bumps very well, and its very responsive and tight
32	219	It was mainly Sync that got my attention when it came to finding a new car
32	220	I do come from a family that has owned quite a lot of fords, because they made pretty decent cars
32	221	Take the build quality up a bit, and you get a new Ford
32	222	The car feels like its built very well
32	223	With only a 140hp engine, it does struggle to get up most hills
32	224	paired up with the 4 speed auto and no torque, driving on hilly roads isn't pleasant
32	225	I've only put 2500 miles on my car so far, but it seems to be pretty great.
33	226	I carefully considered the Honda and Toyota Hybrids
33	227	Personally the style of the available brands next to the Altima was no comparison, with the Altime clearly the winner in style, speed, great gas mileage, price, space and features
33	228	Altima appearance to me is far superior inside and out
33	229	I moved from a Camry due to a total loss accident to the Altima Hybrid for all of the reasons I just mentioned and the superior crash ratings the Altima has
33	230	Drive everything else first, then get into an Altima
33	231	If you like features, speed, a comparable price and style that turns heads everywhere you go, the Altima Hybrid is the clear winner
33	232	"The tax credit and being ""green"" is a winner in any city."
34	233	I love my Rogue so much
34	234	I waited for a year until my lease was up to get this vehicle
34	235	It is my first SUV and I could not be happier
34	236	I got all the features that I wanted from the Wicked Black paint to the Leather seats and AWD
34	237	It makes me happy every time I get into it and take off down the road.
35	238	As an owner of a 1998 Nissan Maxima, I eagerly awaited the release of the re-designed 2009 Maxima
35	239	I purchased the SV with Premium & Technology packages
35	240	"The car handles very well and rides comfortably in spite of the 18"" tires"
35	241	The interior is inviting but has a mix of quality and inferior looking items
35	242	The plastic wood trim is somewhat of an eyesore and seems to detract from the numerous plush features
35	243	However, all of the other interior details make up for this shortcoming
35	244	The engine is very responsive and the CVT is seamless
35	245	You can't even feel the car shift!
36	246	At first glance it looks like a lot for the money but on closer inspection the interior is cheaply constructed, you cannot transfer the phone book from your cell phone and the seats have no real lateral support
36	247	But all of this pales in the face of the terrible suspension
36	248	The ride is rough and jittery with a tendency towards porpoising on almost all surfaces, even those that appear to be smooth and or recently paved
36	249	I would test drive the heck out of a potential purchase and if you experience the slightest bit of what I have described, pass on it and look at something else
36	250	No other car that I have driven in recent years, of any price point, has these awful ride characteristics
37	251	This is a stylish comfortable Camry wagon
37	252	No pretenses of a rear seat (hello cramped RAV4 third row) and no pretending to be an SUV or crossover or whatever you try to call it other than a station wagon
37	253	Yeah they try to call this a crossover too, but we all really know it is a Camry wagon
37	254	The lines are classy, the interior is well designed and uses quality materials, and the totally predictable handling and bulletproof reliability are great for those who don't like any surprises
37	255	Venza gets you from point A to point B with comfort, good-looks and a minimum of fuss or effort.
38	256	I previously owned a 2003 Mercury Sable
38	257	Traded it in for the 2009 Focus because the Sable had too many miles and I wanted something that got better gas mileage
38	258	I am impressed
38	259	It has more get-up-and-go than the Sable, rides every bit as well (actually quieter) and has every bit as much trunk space
38	260	Not to mention that it is more fun to drive
38	261	The Sync system is nice to have, it is good to have that connectivity in a car
38	262	Ford was forward thinking in putting this on their cars
38	263	All in all, I do not regret the trade at all
38	264	To begin with I was worried that the Focus might seem a lot smaller than the Sable
38	265	We didn't loose much.
39	266	Bought truck October 06 2009 notice ripples around fender walls.Took back to dealership
39	267	Would not do anything said it was GM'S fault called them up and they would not do anything also.Just want to let you chevy truck guys or gals know to check out around fender walls for ripples before you buy.
40	268	My review is just that, mine
40	269	I have owned several cars in my life from Mercedes to Chevy
40	270	I am unhappy with this Honda product
40	271	My wife's 1992 Accord was a better car
40	272	Period.
41	273	I love this car, and it has been great
41	274	At 1200 miles it feels like a dream to drive..
41	275	no issues
41	276	I get plenty of compliments and makes me feel happy to drive it
41	277	The engine has good giddy up in the low-speed range
41	278	Once you're higher up, engine feels like it struggles to move up, nevertheless it's fast enough for me unless you're looking for a speeding ticket.
42	279	Most people won't care about this, but there is a design flaw in the Flex
42	280	I ordered one and felt the vehicle was ideal for me in most ways
42	281	I'm very tall and the headroom and legroom are exceptional
42	282	"Which is great, except for the fact that a tall person (I'm 6'7"") cannot comfortably drive this vehicle! Because it lacks a telescoping steering column, even my long arms are at full extension with no bend at the elbows"
42	283	This became uncomfortable even during a short drive; during a long trip it would be unbearable.
43	284	Style is obviously good
43	285	But the interior (radio and environmental) is not that impressive
43	286	The fan comes on full speed with a twist of the temp control and other buttons/knobs..
43	287	I find it pretty annoying
43	288	The leather seems pretty cheesy
43	289	If you put something lightly heavy on the seats it show an indentation forever
43	290	I have the std
43	291	Speaker system installed
43	292	The sound quality is not horrible, but its pretty bad
43	293	The speedo is also off by one mph
43	294	At night the interior lights do night dime enough
43	295	It gets pretty bright once your eyes adjust to dark.
44	296	We did a lot of research on the Venza before buying it
44	297	The Pros far out weigh the Cons
44	298	We have owned a Ford Edge, which drives like a truck
44	299	The Venza drives like a luxury car
44	300	We drove both the 4 cyl and the 6 cyl Venza
44	301	The 6 cyl has better performance and had a better response time
44	302	The engine on the 6 cy is a lot quieter than the 4 cyl
44	303	We ordered our Aloe Green model with leather and without the Nav
44	304	Our Garman does the trick, we can take it with us when leave the car, and we can update the GPS on our computer.
45	305	We traded in our 04 Chrysler Town and Country that had 170,000 (my husband drives a lot for work)for the CR V
45	306	What a great and fun to drive truck it is! Our other car is a Volvo XC90, and while I enjoy driving it, the CR V is so easy to maneuver and park that I have virtually kidnapped th CR V from my husband
45	307	It really is a great value compact SUV for the money, not to mention the Honda reliability
45	308	This is our 3rd Honda and we couldn't be more pleased.
46	309	Buying a 2009 Accord has been the worst purchase I've made in the last 20 years
